sentence_id,documento,orden_frase,tema,keyword_detectada,frase_original,frase_normalizada,n_palabras,n_positivo,n_negativo,polaridad_bruta,polaridad_normalizada,etiqueta_polaridad,palabras_positivas_detectadas,palabras_negativas_detectadas
heraldo_002844,heraldo,2844,patria,patria,"Como mujer y como patriota, que sólo anhela el progro de a patria en general, vel de la mujer del muño y obre todo el de la puertormena en particulroniendo los nos pasas la letura y estuna consala de esa compilacon perma del pueres lumno. inte el rigen de desenvolvimiento de los pueblos y de a bello deserar a estudio de la muiera, me es encia a gentir y empresar las inanitus lamentos de lo rado que ente al purdo decir de la ron hamana por loner el velo del misterio de la vive igen de nuestra auna que es floria y al en tus los ramos de saber encontramos el vido pero que nos han de indo los humanidades suprecila, y lo importantes proplenas en que taloian los hombres del precente ven los cuales dos de aportar en grano de quema, la mujer conciente e ilustrada de nuestros disNo es la mujer creada con inteligencia y corazón, lamente para ser ama de las ni maquina de reproduer sa misión intelecuna e igual a la del hombre ele par en alma obre las miserias humanos audar al poes de los pueblos, y bugar pos y tratar de pensilos cretos de la vida en que tio de la mulera, vino no aberto para sumiración y esuna Nuena mujer puertorriquena de mediana entura las de nula mer este resumen valoso del quer de la mumaniCorte y Remita Hoy Mismo 23 tomos por THE GROLIER SOCIETY Fecha....",como mujer y como patriota que solo anhela el progro de a patria en general vel de la mujer del muno y obre todo el de la puertormena en particulroniendo los nos pasas la letura y estuna consala de esa compilacon perma del pueres lumno inte el rigen de desenvolvimiento de los pueblos y de a bello deserar a estudio de la muiera me es encia a gentir y empresar las inanitus lamentos de lo rado que ente al purdo decir de la ron hamana por loner el velo del misterio de la vive igen de nuestra auna que es floria y al en tus los ramos de saber encontramos el vido pero que nos han de indo los humanidades suprecila y lo importantes proplenas en que taloian los hombres del precente ven los cuales dos de aportar en grano de quema la mujer conciente e ilustrada de nuestros disno es la mujer creada con inteligencia y corazon lamente para ser ama de las ni maquina de reproduer sa mision intelecuna e igual a la del hombre ele par en alma obre las miserias humanos audar al poes de los pueblos y bugar pos y tratar de pensilos cretos de la vida en que tio de la mulera vino no aberto para sumiracion y esuna nuena mujer puertorriquena de mediana entura las de nula mer este resumen valoso del quer de la mumanicorte y remita hoy mismo 23 tomos por the grolier society fecha,244,6,0,6,0.0245901639344262,positiva,alma; bello; ilustrada; inteligencia; saber; vida,
heraldo_002844,heraldo,2844,patria,patriota,"Como mujer y como patriota, que sólo anhela el progro de a patria en general, vel de la mujer del muño y obre todo el de la puertormena en particulroniendo los nos pasas la letura y estuna consala de esa compilacon perma del pueres lumno. inte el rigen de desenvolvimiento de los pueblos y de a bello deserar a estudio de la muiera, me es encia a gentir y empresar las inanitus lamentos de lo rado que ente al purdo decir de la ron hamana por loner el velo del misterio de la vive igen de nuestra auna que es floria y al en tus los ramos de saber encontramos el vido pero que nos han de indo los humanidades suprecila, y lo importantes proplenas en que taloian los hombres del precente ven los cuales dos de aportar en grano de quema, la mujer conciente e ilustrada de nuestros disNo es la mujer creada con inteligencia y corazón, lamente para ser ama de las ni maquina de reproduer sa misión intelecuna e igual a la del hombre ele par en alma obre las miserias humanos audar al poes de los pueblos, y bugar pos y tratar de pensilos cretos de la vida en que tio de la mulera, vino no aberto para sumiración y esuna Nuena mujer puertorriquena de mediana entura las de nula mer este resumen valoso del quer de la mumaniCorte y Remita Hoy Mismo 23 tomos por THE GROLIER SOCIETY Fecha....",como mujer y como patriota que solo anhela el progro de a patria en general vel de la mujer del muno y obre todo el de la puertormena en particulroniendo los nos pasas la letura y estuna consala de esa compilacon perma del pueres lumno inte el rigen de desenvolvimiento de los pueblos y de a bello deserar a estudio de la muiera me es encia a gentir y empresar las inanitus lamentos de lo rado que ente al purdo decir de la ron hamana por loner el velo del misterio de la vive igen de nuestra auna que es floria y al en tus los ramos de saber encontramos el vido pero que nos han de indo los humanidades suprecila y lo importantes proplenas en que taloian los hombres del precente ven los cuales dos de aportar en grano de quema la mujer conciente e ilustrada de nuestros disno es la mujer creada con inteligencia y corazon lamente para ser ama de las ni maquina de reproduer sa mision intelecuna e igual a la del hombre ele par en alma obre las miserias humanos audar al poes de los pueblos y bugar pos y tratar de pensilos cretos de la vida en que tio de la mulera vino no aberto para sumiracion y esuna nuena mujer puertorriquena de mediana entura las de nula mer este resumen valoso del quer de la mumanicorte y remita hoy mismo 23 tomos por the grolier society fecha,244,6,0,6,0.0245901639344262,positiva,alma; bello; ilustrada; inteligencia; saber; vida,
heraldo_000785,heraldo,785,patria,nacional,"País..... — Auxilio para el Estudio del Arte Artículos por BUng Young Scarpitta Steinlen Roding Sloan Bridgman-Branguen Fogart Ayuntamiento de Madrid Nº 23 HERALDO DE LA MUJER MENSAJE DE LA DOCTORA ANNA HOWER SHAW A TODAS LAS MUJERES DE AMERICA ""Deseo que todas las mujeres americanas, puedan tener una parte activa en la vida de América, lo cual considero la cosa más importante que toda persona, hombre o mujer puedan llevar a cabo. ""Así también, como yo creo que la vida de familia es la más dichosa, cuando el hombre y la mujer, en intimo consorcio, asumen igualmente sus problemas y responsabilidades; asi también yo creo que la vida en común, y la vida nacional, nunca podrán llegar á su perfeccionamiento, hasta que los hombres y las mujeres trabajen unidos para realizar sus altos ideales. ""A las mujeres que han obtenido la franquicia del voto, les deseo las ilumine Dios, para que puedan cumplir sus sagrados deberes con eficiencia."" Ayuntamiento de Madrid PARÍS BAZAR P.",pais auxilio para el estudio del arte articulos por bung young scarpitta steinlen roding sloan bridgman branguen fogart ayuntamiento de madrid n 23 heraldo de la mujer mensaje de la doctora anna hower shaw a todas las mujeres de america deseo que todas las mujeres americanas puedan tener una parte activa en la vida de america lo cual considero la cosa mas importante que toda persona hombre o mujer puedan llevar a cabo asi tambien como yo creo que la vida de familia es la mas dichosa cuando el hombre y la mujer en intimo consorcio asumen igualmente sus problemas y responsabilidades asi tambien yo creo que la vida en comun y la vida nacional nunca podran llegar a su perfeccionamiento hasta que los hombres y las mujeres trabajen unidos para realizar sus altos ideales a las mujeres que han obtenido la franquicia del voto les deseo las ilumine dios para que puedan cumplir sus sagrados deberes con eficiencia ayuntamiento de madrid paris bazar p,165,5,0,5,0.0303030303030303,positiva,importante; vida,
heraldo_001489,heraldo,1489,patria,patria,"El alma de una compatriota entusiasta y progresista, esta y estará siempre con vosotros infundiendos los enuvios redenores del ansia de saber y de alenta nobles ideales por humanismo. por patronsmo, y para que podas cumplir conciencia los altos deberes de la vida y los que al nacer habes contrado, con esta nuestra patria.",el alma de una compatriota entusiasta y progresista esta y estara siempre con vosotros infundiendos los enuvios redenores del ansia de saber y de alenta nobles ideales por humanismo por patronsmo y para que podas cumplir conciencia los altos deberes de la vida y los que al nacer habes contrado con esta nuestra patria,54,5,0,5,0.0925925925925925,positiva,alma; entusiasta; nobles; saber; vida,
heraldo_001700,heraldo,1700,patria,patria,"Y resuelta la legendaria España, a marchar porma via de progreso posito concede el derecho de sufrago sus mujeres, sin lucha cas por parte de estas: por un rego noble y humano de un gobierno periorpudente el cual considerando que actuar contra las orientes de la enen ena atraer el derrento más caperlo sobre su nación tomo la via quella del progreso. prefriendo nuralor con al que suilarse en la enerosa noche del engerresmo y la mulación. pen por nuestra Male atorta. quien hubiera crello que en los Estados Unidos habria, tenido que hallar la mujer como herina para tener el rentamiento de s dereno, durante encuenta años y en mamaña lo consiguiera en un minto: Lección hermosa que ha dado la patria genial de Ladel la Catolea, a la poderosa nación que se enoranno en hamare cuna de la Libertad y estandarte de la penorra del mundo.",y resuelta la legendaria espana a marchar porma via de progreso posito concede el derecho de sufrago sus mujeres sin lucha cas por parte de estas por un rego noble y humano de un gobierno periorpudente el cual considerando que actuar contra las orientes de la enen ena atraer el derrento mas caperlo sobre su nacion tomo la via quella del progreso prefriendo nuralor con al que suilarse en la enerosa noche del engerresmo y la mulacion pen por nuestra male atorta quien hubiera crello que en los estados unidos habria tenido que hallar la mujer como herina para tener el rentamiento de s dereno durante encuenta anos y en mamana lo consiguiera en un minto leccion hermosa que ha dado la patria genial de ladel la catolea a la poderosa nacion que se enoranno en hamare cuna de la libertad y estandarte de la penorra del mundo,148,5,0,5,0.0337837837837837,positiva,hermosa; libertad; noble; progreso,
heraldo_000153,heraldo,153,raza,blanca,"Que un joven cuna gallarda A MARINA S Presencia, la conmovía Con pasión, su hermosa alma; Recordo que sus desdenes, y su altanera mirada, Arrojaron del Castillo, Al doncel que tanto amaba, Al de la blanca arrotas, Y la corva cimitarra: Ahora él en cruda querra, Se fué a servir a su Patria, Y ella echo de su recuerdo, La tenas triste punzada; Y vivía desde entonces, Triste llorosa enlutada.....",que un joven cuna gallarda a marina s presencia la conmovia con pasion su hermosa alma recordo que sus desdenes y su altanera mirada arrojaron del castillo al doncel que tanto amaba al de la blanca arrotas y la corva cimitarra ahora el en cruda querra se fue a servir a su patria y ella echo de su recuerdo la tenas triste punzada y vivia desde entonces triste llorosa enlutada,70,2,3,-1,-0.0142857142857142,negativa,alma; hermosa,desdenes; triste
heraldo_000266,heraldo,266,raza,latino,"Ninguno de los países Latino Americanos participaron de la guerra escento el praniContrario este informe hay este otroLas 16 pequenas naciones están divididas por continentes de este modo Europa Belgica, Cuehojovalia crecia Polonia, Portural, Rumania y Servia.",ninguno de los paises latino americanos participaron de la guerra escento el pranicontrario este informe hay este otrolas 16 pequenas naciones estan divididas por continentes de este modo europa belgica cuehojovalia crecia polonia portural rumania y servia,37,0,1,-1,-0.027027027027027,negativa,,guerra
heraldo_000460,heraldo,460,raza,raza,"Una preparación de levadura perfecta para hacer tortas, bizcochos, panecillos, pan derreres misma y enos. uno de los muchos pasteles que se pueden hacer con su ayuda se indica con la senen muePASTEL ENUELTO CON JALEA Tusto raza de ancar. mas nina encaradas de agua caliente A E RONAL BARIN PONDER nerlenes y egrane los ingredientes seos remecalos con el huero bien para serenerar los sienten marse aga que que en geoy Pan sus sala me ban aparesara murea no pues mas mana de esampara me muesa enen me mano pensan en un para no de ser sacuena una ena mura de paber maen ber en bompran car un ser esos en en las enenos ves, la muuna en menen en esta caron las una generala muede prepara meno la para, al de las para mullas sus mal mejoseno para que hacer de la empramente mendo superan en peso y empo musa parte mueEl Manual Roval del Panadero y Pastellero, conteniendo muchas otras recetas se enviará por correo gratis a toda persona que nos mande su nombre y dirección.",una preparacion de levadura perfecta para hacer tortas bizcochos panecillos pan derreres misma y enos uno de los muchos pasteles que se pueden hacer con su ayuda se indica con la senen muepastel enuelto con jalea tusto raza de ancar mas nina encaradas de agua caliente a e ronal barin ponder nerlenes y egrane los ingredientes seos remecalos con el huero bien para serenerar los sienten marse aga que que en geoy pan sus sala me ban aparesara murea no pues mas mana de esampara me muesa enen me mano pensan en un para no de ser sacuena una ena mura de paber maen ber en bompran car un ser esos en en las enenos ves la muuna en menen en esta caron las una generala muede prepara meno la para al de las para mullas sus mal mejoseno para que hacer de la empramente mendo superan en peso y empo musa parte mueel manual roval del panadero y pastellero conteniendo muchas otras recetas se enviara por correo gratis a toda persona que nos mande su nombre y direccion,179,1,2,-1,-0.0055865921787709,negativa,bien,mal; peso
heraldo_000650,heraldo,650,raza,latino,"Femenina Latino americana crue hatin amerian vonan surres alienen rue secreta. yor que paceres comer cualque tan Rocner por que manata porto Rico, esdes. en or ana mal a once.",femenina latino americana crue hatin amerian vonan surres alienen rue secreta yor que paceres comer cualque tan rocner por que manata porto rico esdes en or ana mal a once,30,0,1,-1,-0.0333333333333333,negativa,,mal
heraldo_001174,heraldo,1174,raza,mestizo,"Entónces, el botero Simón, mestizo de musculatura hercilea, se subió sobre el alféizar de una ventana, y con voz fuerte y llena de unción, entono el canto religioso Santo Dios, Santo Fuerte, Santo Inmortal, libranos y eñor de todo mal.",entonces el botero simon mestizo de musculatura hercilea se subio sobre el alfeizar de una ventana y con voz fuerte y llena de uncion entono el canto religioso santo dios santo fuerte santo inmortal libranos y enor de todo mal,40,0,1,-1,-0.025,negativa,,mal
heraldo_001689,heraldo,1689,raza,negra,"Quisiera del tiempo salvando centurias vivir en los días de los galanteos y en mi amberes milado de pluma que el veno amoroso defina á sus besos ha ana rerciada mi negra ciona mis alas polanas mis ancios presescos tras la ppila bordada de pro mirar aburarse el rigido aceros. buscando amoras cruzar calcuelas en pos de aventuras lances don juaneros, vala enta ala muere escalar las rapias de algin pledos pacitos querio. bustera ser hada quiera ser hada de los tiempos vicios.",quisiera del tiempo salvando centurias vivir en los dias de los galanteos y en mi amberes milado de pluma que el veno amoroso defina a sus besos ha ana rerciada mi negra ciona mis alas polanas mis ancios presescos tras la ppila bordada de pro mirar aburarse el rigido aceros buscando amoras cruzar calcuelas en pos de aventuras lances don juaneros vala enta ala muere escalar las rapias de algin pledos pacitos querio bustera ser hada quiera ser hada de los tiempos vicios,83,0,1,-1,-0.0120481927710843,negativa,,vicios
heraldo_003253,heraldo,3253,raza,latino,"Hay que admirar en Carmela, esa facilidad para el estudo de los intomas pues además de poser en bastante prección el frances males, alemina inalano y portumás que ha procurado conocer para poder aprecir sus fueras adora domina el grade se encante quiley metro de los calleros anderramanes a tanto enterlos acen al Catrato de condora, y de los culos que la autora de cintinos de Amora poeta de los ambos es ante todo lica, pues los carecían de los grandes elementos hatoricos que rando las roperas han uno asunto a la inspiración la prigo y latino.",hay que admirar en carmela esa facilidad para el estudo de los intomas pues ademas de poser en bastante preccion el frances males alemina inalano y portumas que ha procurado conocer para poder aprecir sus fueras adora domina el grade se encante quiley metro de los calleros anderramanes a tanto enterlos acen al catrato de condora y de los culos que la autora de cintinos de amora poeta de los ambos es ante todo lica pues los carecian de los grandes elementos hatoricos que rando las roperas han uno asunto a la inspiracion la prigo y latino,97,0,1,-1,-0.0103092783505154,negativa,,males
heraldo_003268,heraldo,3268,raza,blanca,"Y así vamos por la senda dolorosa, vo venido por el hondo malencio de mis duelos y ella blanca y luminos derramando con dulara a consuelo como lirios que caveron en un lago de amargura. otra sombra misteriosa larga y triste se la cruzado en mi camino por un gesto de amena. ven la fuena tembrosa. de sus ojos cuando pasa. hay un raro alumbramiento sibino.",y asi vamos por la senda dolorosa vo venido por el hondo malencio de mis duelos y ella blanca y luminos derramando con dulara a consuelo como lirios que caveron en un lago de amargura otra sombra misteriosa larga y triste se la cruzado en mi camino por un gesto de amena ven la fuena tembrosa de sus ojos cuando pasa hay un raro alumbramiento sibino,66,1,2,-1,-0.0151515151515151,negativa,consuelo,dolorosa; triste
heraldo_003270,heraldo,3270,raza,blanca,Y es que vamos por la senda dolorosa vo vencido por el hondo malencio de mis duelos y ella blanca y luminos. derramando con dulara sus consuelos como lirios que caveron en mi lago de amargura.,y es que vamos por la senda dolorosa vo vencido por el hondo malencio de mis duelos y ella blanca y luminos derramando con dulara sus consuelos como lirios que caveron en mi lago de amargura,36,0,1,-1,-0.0277777777777777,negativa,,dolorosa
heraldo_001402,heraldo,1402,raza,raza,"El fué quien se aperibio del peligro de las ramas de la raza germanita, que se desarrollaban aparte y que podian verse envuelas en el conmueta y para prevenir el peligro undo pecas para los jóvenes del Canada muralia Nuena elanda, Arica del Sur.",el fue quien se aperibio del peligro de las ramas de la raza germanita que se desarrollaban aparte y que podian verse envuelas en el conmueta y para prevenir el peligro undo pecas para los jovenes del canada muralia nuena elanda arica del sur,44,0,2,-2,-0.0454545454545454,negativa,,peligro
heraldo_000096,heraldo,96,raza,latina,"Más tarde, cuando hayamos logrado formar la gran LIGA INTERNACIONAL LAINOAMERICANA, integrada por las literatas y mujeres más prestigiosas de la América-Latina, será un miembro de ella.",mas tarde cuando hayamos logrado formar la gran liga internacional lainoamericana integrada por las literatas y mujeres mas prestigiosas de la america latina sera un miembro de ella,28,0,0,0,0.0,neutra,,
heraldo_000132,heraldo,132,raza,latino,NOTA.—También las mujeres latino americanas debenos mudar a la gran sus que nos el mundo el camino de nuestra reparados metar bramos a la en esperan todas las intas de la mante amente.,nota tambien las mujeres latino americanas debenos mudar a la gran sus que nos el mundo el camino de nuestra reparados metar bramos a la en esperan todas las intas de la mante amente,34,0,0,0,0.0,neutra,,
heraldo_000265,heraldo,265,raza,latino,"Los Latino Americanos al darse cuenta de que las naciones europeas estaban en minoría, quisieron recomendar al Consejo se concediese a los europeos asientos más en cada Comisión, pero los Europeos, excepto portural, se negaron a atetar la concesión.",los latino americanos al darse cuenta de que las naciones europeas estaban en minoria quisieron recomendar al consejo se concediese a los europeos asientos mas en cada comision pero los europeos excepto portural se negaron a atetar la concesion,39,0,0,0,0.0,neutra,,
heraldo_000469,heraldo,469,raza,latino,ORGANO DE LA ALIANZA FEMENINA LATINO.-AMERICANA.,organo de la alianza femenina latino americana,7,0,0,0,0.0,neutra,,
heraldo_000503,heraldo,503,raza,latino,"Miembro y Representante en Caguas, de la Alianza Femenina Latino-Americana.",miembro y representante en caguas de la alianza femenina latino americana,11,0,0,0,0.0,neutra,,
heraldo_000722,heraldo,722,raza,negro,"No, inde esa hura de negro y biendo cazaro.",no inde esa hura de negro y biendo cazaro,9,0,0,0,0.0,neutra,,
heraldo_000747,heraldo,747,raza,blanco,"Satín Pa m Beacha Crepés Habutas Lonsines COLORES DE MODA.—Verde, Azul Copenhague, Fan, Color carne, blanco, azul marino, al añil, En verano conviene usar te las lavables para reuniones. en clubs, terrazas, restauranes y roofgardens donde se congregan las más graciosas mujeres para gozar de la conversación chispeante y amena.",satin pa m beacha crepes habutas lonsines colores de moda verde azul copenhague fan color carne blanco azul marino al anil en verano conviene usar te las lavables para reuniones en clubs terrazas restauranes y roofgardens donde se congregan las mas graciosas mujeres para gozar de la conversacion chispeante y amena,51,0,0,0,0.0,neutra,,
heraldo_001084,heraldo,1084,raza,raza,"Tratar de falsear el carácter general de la raza, es incurrir en un crimen de lesa verdad, y separarse de las tendencias modernas que nos llevan a copiar la naturaleza tal cual ella es, lo mismo con el pincel del artista que con la pluma del escritor.",tratar de falsear el caracter general de la raza es incurrir en un crimen de lesa verdad y separarse de las tendencias modernas que nos llevan a copiar la naturaleza tal cual ella es lo mismo con el pincel del artista que con la pluma del escritor,47,0,0,0,0.0,neutra,,
heraldo_001219,heraldo,1219,raza,blanca,"Nansú para la ropa blanca, Muselinas, linó y cambray para los trajecitos.",nansu para la ropa blanca muselinas lino y cambray para los trajecitos,12,0,0,0,0.0,neutra,,
heraldo_001334,heraldo,1334,raza,blanca,"Sibrarios en lo posible del terrible ante de la peste blanca, que diera nuestra población conque estamos.",sibrarios en lo posible del terrible ante de la peste blanca que diera nuestra poblacion conque estamos,17,0,0,0,0.0,neutra,,
heraldo_001581,heraldo,1581,raza,raza,"Ni que la cagueña baile como una silfide; y la suavanesa, la recibena, la falarana, huma cuena, bavamonesa y demás bellas de esta hermoa tierra de los amores en gracia y gentilera tanbien comptan, con las damas más encumbradas y más bonitas de esta raza privilegiada, que de a los ojos de todas clara las neguras profundas deconocidas de esos abismos de sentimiento, de inteligencia de idealidad y de amor de algo misterioso y grande, que re y palpita, en el fondo de sus pupilas, como promesas dulces y halagadoras, de placeres y dichas embriagadoras de ardientes y siblimes arrobamientos del vibrar de la vida. atmos sin cuento.",ni que la caguena baile como una silfide y la suavanesa la recibena la falarana huma cuena bavamonesa y demas bellas de esta hermoa tierra de los amores en gracia y gentilera tanbien comptan con las damas mas encumbradas y mas bonitas de esta raza privilegiada que de a los ojos de todas clara las neguras profundas deconocidas de esos abismos de sentimiento de inteligencia de idealidad y de amor de algo misterioso y grande que re y palpita en el fondo de sus pupilas como promesas dulces y halagadoras de placeres y dichas embriagadoras de ardientes y siblimes arrobamientos del vibrar de la vida atmos sin cuento,108,4,0,4,0.037037037037037,positiva,amor; bellas; inteligencia; vida,
heraldo_002243,heraldo,2243,raza,blanca,"Penila Conte, la dulce poerisa, cagueña, alma blanca abierra a todo lo moble y grandeDoña Micada Nusa de Losas. mujer superior y porable por muchos concentos esposa que rie de don Ramón B.",penila conte la dulce poerisa caguena alma blanca abierra a todo lo moble y grandedona micada nusa de losas mujer superior y porable por muchos concentos esposa que rie de don ramon b,33,3,0,3,0.0909090909090909,positiva,alma; dulce; superior,
heraldo_003116,heraldo,3116,raza,blanco,"Tracitos de LINO BLANCO liso o floreado, o bien bordados. llusión de las madres esver sus pares tan rozagantes, frescos y bellos de faz radiante.",tracitos de lino blanco liso o floreado o bien bordados llusion de las madres esver sus pares tan rozagantes frescos y bellos de faz radiante,25,3,0,3,0.12,positiva,bellos; bien; radiante,
heraldo_003264,heraldo,3264,raza,negro,"Yo vi entonces sus cabellos y eran negros en encios de icinto. de negror la indistino que bien se, que no habrá negro como el de elos. y sus manos eran finos vera blancas cual palomas que en un vuelo de perujer por regiones peregrinas, bajer las piedades milagrosas del amor y del consuelo.",yo vi entonces sus cabellos y eran negros en encios de icinto de negror la indistino que bien se que no habra negro como el de elos y sus manos eran finos vera blancas cual palomas que en un vuelo de perujer por regiones peregrinas bajer las piedades milagrosas del amor y del consuelo,54,3,0,3,0.0555555555555555,positiva,amor; bien; consuelo,
