sentence_id,documento,orden_frase,tema,keyword_detectada,frase_original,frase_normalizada,n_palabras,n_positivo,n_negativo,polaridad_bruta,polaridad_normalizada,etiqueta_polaridad,palabras_positivas_detectadas,palabras_negativas_detectadas
heraldo_001807,heraldo,1807,hogar,casa,"Trde documentos históricos importantísimos como empre esta publicación enrada por muestro ilustre Historiados pre Caverano con y roste la que no debía altar en casa de mingin puertorriqueño de valerCONOTENCIA May sentida la damos a den Oevado Abril y demás familia de muestra querida prina Rra sabia de Abril, que acaba de talecer en santure, en cua de un hija Mercede Abril de Cerdera Despues de una vida consagrada al bien y a la precurea de todas las virtudes crerianas nos abandona ra, dejando un lecto hondo y entido en el corazón de rosos sus familiares y presidos.",trde documentos historicos importantisimos como empre esta publicacion enrada por muestro ilustre historiados pre caverano con y roste la que no debia altar en casa de mingin puertorriqueno de valerconotencia may sentida la damos a den oevado abril y demas familia de muestra querida prina rra sabia de abril que acaba de talecer en santure en cua de un hija mercede abril de cerdera despues de una vida consagrada al bien y a la precurea de todas las virtudes crerianas nos abandona ra dejando un lecto hondo y entido en el corazon de rosos sus familiares y presidos,98,4,0,4,0.0408163265306122,positiva,bien; sabia; vida; virtudes,
heraldo_002071,heraldo,2071,hogar,hogar,"NO L Jugando están los ángeles con plumones de cisnes nos de espuna y gotas, de encio Con entaapara y en en contantos eros caen sus acreos lugueres sobre la ciudad iluminada por la lue encial. que muy pronto quedan los mas altos erreros, las amolas venidas las aceras esa inas parana esaumeriles rancias y pansenes repesos de alpresuprante conse mientras los cuentes en los os anuales e empanimas prenes y amanos contemplando sonrientes la primera merada pesuenan gritos intarles y eclamaciones de alcana maner meras alegrando en luego elegran que alcana y embente enanto ha pocado y hace mensar que no nos en completamente plicados este Paree que esta en los cielos cuantos necesitan del Hoy de la mere para reponer su salla permana, quien adoro por ser adorable y porque también es para mi en pera egrana. mares, una presentación arra mueuna contita de un hogar que la no este sinó como culto sagrado del alma y de la mente como los inesangnible que le a las sombras luminando el camino largo y corto por recorre. es una de los miles que esperan recaberar la alegria y muerza gracias al irio, y llena de le y de amor.",no l jugando estan los angeles con plumones de cisnes nos de espuna y gotas de encio con entaapara y en en contantos eros caen sus acreos lugueres sobre la ciudad iluminada por la lue encial que muy pronto quedan los mas altos erreros las amolas venidas las aceras esa inas parana esaumeriles rancias y pansenes repesos de alpresuprante conse mientras los cuentes en los os anuales e empanimas prenes y amanos contemplando sonrientes la primera merada pesuenan gritos intarles y eclamaciones de alcana maner meras alegrando en luego elegran que alcana y embente enanto ha pocado y hace mensar que no nos en completamente plicados este paree que esta en los cielos cuantos necesitan del hoy de la mere para reponer su salla permana quien adoro por ser adorable y porque tambien es para mi en pera egrana mares una presentacion arra mueuna contita de un hogar que la no este sino como culto sagrado del alma y de la mente como los inesangnible que le a las sombras luminando el camino largo y corto por recorre es una de los miles que esperan recaberar la alegria y muerza gracias al irio y llena de le y de amor,200,5,1,4,0.02,positiva,alegria; alma; amor; culto; sagrado,sombras
heraldo_000072,heraldo,72,mujer,mujer,Davia oray AMONO WOMAN OS LATIN COUNTRIES.............................. y cerardine Mala roscher Representantes de Heraldo de la Mujer.............................,davia oray amono woman os latin countries y cerardine mala roscher representantes de heraldo de la mujer,17,0,1,-1,-0.0588235294117647,negativa,,mala
heraldo_000129,heraldo,129,mujer,mujeres,"Las naciones sino americanas deben ser las primeras enreconoceres acaen maneranas primer el la rata de un esposo entenamiento nata unto era en el pasado se la nacios que erana genera de sus mos gasta ineralmente sus resuras perentes quelos sin muran eguiara mujeres en enento entemente de apar y muerera de uno es una masan en que es ene enanar el para se en mines de habitantes, las mas proso de mundo que mumente era enupirador. pobre una nes de naciones para estar eneras y satanmar las interesencia de los renas porvenenos dos en, para ene miranes nos repernes arrien, en agra contrar en esposa impena.",las naciones sino americanas deben ser las primeras enreconoceres acaen maneranas primer el la rata de un esposo entenamiento nata unto era en el pasado se la nacios que erana genera de sus mos gasta ineralmente sus resuras perentes quelos sin muran eguiara mujeres en enento entemente de apar y muerera de uno es una masan en que es ene enanar el para se en mines de habitantes las mas proso de mundo que mumente era enupirador pobre una nes de naciones para estar eneras y satanmar las interesencia de los renas porvenenos dos en para ene miranes nos repernes arrien en agra contrar en esposa impena,107,0,1,-1,-0.0093457943925233,negativa,,pobre
heraldo_000129,heraldo,129,mujer,esposa,"Las naciones sino americanas deben ser las primeras enreconoceres acaen maneranas primer el la rata de un esposo entenamiento nata unto era en el pasado se la nacios que erana genera de sus mos gasta ineralmente sus resuras perentes quelos sin muran eguiara mujeres en enento entemente de apar y muerera de uno es una masan en que es ene enanar el para se en mines de habitantes, las mas proso de mundo que mumente era enupirador. pobre una nes de naciones para estar eneras y satanmar las interesencia de los renas porvenenos dos en, para ene miranes nos repernes arrien, en agra contrar en esposa impena.",las naciones sino americanas deben ser las primeras enreconoceres acaen maneranas primer el la rata de un esposo entenamiento nata unto era en el pasado se la nacios que erana genera de sus mos gasta ineralmente sus resuras perentes quelos sin muran eguiara mujeres en enento entemente de apar y muerera de uno es una masan en que es ene enanar el para se en mines de habitantes las mas proso de mundo que mumente era enupirador pobre una nes de naciones para estar eneras y satanmar las interesencia de los renas porvenenos dos en para ene miranes nos repernes arrien en agra contrar en esposa impena,107,0,1,-1,-0.0093457943925233,negativa,,pobre
heraldo_000205,heraldo,205,mujer,dama,"Una semana más tarde los periódicos publicaban la noticia de que una dama tan deliciosamente permosa como ladame Ravier, habia resultado una terrible espía pagada por alemana, y que mientras esperaba ser deportada a Francia halia muerto misteriosamente en Elis islana.",una semana mas tarde los periodicos publicaban la noticia de que una dama tan deliciosamente permosa como ladame ravier habia resultado una terrible espia pagada por alemana y que mientras esperaba ser deportada a francia halia muerto misteriosamente en elis islana,41,0,1,-1,-0.024390243902439,negativa,,muerto
heraldo_000241,heraldo,241,mujer,mujer,"Declarar obligatoria la ensenanas elemental de las erios quietando de las senoras que en los mas de la semana que se señalen, según las circunstanlas permitan su servidumbre femenina que no sena leer ni escribir la asistencia de una hora a las clases que se establerque su corazón magnánimo ha comprendido perectamente enales son los deberes de la mujer y mas aún los de las que se sienten eministas pues sur deber es dar la mano, y proteser, a la mujer a uno de todas las estras sociales.",declarar obligatoria la ensenanas elemental de las erios quietando de las senoras que en los mas de la semana que se senalen segun las circunstanlas permitan su servidumbre femenina que no sena leer ni escribir la asistencia de una hora a las clases que se establerque su corazon magnanimo ha comprendido perectamente enales son los deberes de la mujer y mas aun los de las que se sienten eministas pues sur deber es dar la mano y proteser a la mujer a uno de todas las estras sociales,88,0,1,-1,-0.0113636363636363,negativa,,servidumbre
heraldo_000241,heraldo,241,mujer,femenina,"Declarar obligatoria la ensenanas elemental de las erios quietando de las senoras que en los mas de la semana que se señalen, según las circunstanlas permitan su servidumbre femenina que no sena leer ni escribir la asistencia de una hora a las clases que se establerque su corazón magnánimo ha comprendido perectamente enales son los deberes de la mujer y mas aún los de las que se sienten eministas pues sur deber es dar la mano, y proteser, a la mujer a uno de todas las estras sociales.",declarar obligatoria la ensenanas elemental de las erios quietando de las senoras que en los mas de la semana que se senalen segun las circunstanlas permitan su servidumbre femenina que no sena leer ni escribir la asistencia de una hora a las clases que se establerque su corazon magnanimo ha comprendido perectamente enales son los deberes de la mujer y mas aun los de las que se sienten eministas pues sur deber es dar la mano y proteser a la mujer a uno de todas las estras sociales,88,0,1,-1,-0.0113636363636363,negativa,,servidumbre
heraldo_000533,heraldo,533,mujer,mujer,"MIGUEL GUERRA Cuando el Hon Representante Miguel Guea esposo en la canara su opinión de que noestaba autoriada la Legalaura de Puerto mio para concer el volos a la mujer incene me la mujer puertorriqueña doblaría numildemente la cabeza y se sometería a esa decisión como un hecho iro pero la mujer puertorra. queña esta completamente decidida detender a derecho ahora y sempre Considere el se querra, y demás miembros Ayuntamiento de Madrid HERALDO DE LA MUJER. de la Legislatura, la autorizada opinión del Semador ales pondecier miembro del Conte responsable del deta, ones.",miguel guerra cuando el hon representante miguel guea esposo en la canara su opinion de que noestaba autoriada la legalaura de puerto mio para concer el volos a la mujer incene me la mujer puertorriquena doblaria numildemente la cabeza y se someteria a esa decision como un hecho iro pero la mujer puertorra quena esta completamente decidida detender a derecho ahora y sempre considere el se querra y demas miembros ayuntamiento de madrid heraldo de la mujer de la legislatura la autorizada opinion del semador ales pondecier miembro del conte responsable del deta ones,94,0,1,-1,-0.0106382978723404,negativa,,guerra
heraldo_000558,heraldo,558,mujer,madre,"Lo que fué siempre de los nobles guía, lo que avento furiosa tramontana. por lo que era vo la sangre mía? proF TI POR BEGO ICENTE FEJER Has muerto No la muerte tras sí lleva el olvido, y aún te recuerdo voLa muerte dulce madre, tu forma ha destruido. pero tú imagen no.",lo que fue siempre de los nobles guia lo que avento furiosa tramontana por lo que era vo la sangre mia prof ti por bego icente fejer has muerto no la muerte tras si lleva el olvido y aun te recuerdo vola muerte dulce madre tu forma ha destruido pero tu imagen no,53,2,3,-1,-0.0188679245283018,negativa,dulce; nobles,muerte; muerto
heraldo_000650,heraldo,650,mujer,femenina,"Femenina Latino americana crue hatin amerian vonan surres alienen rue secreta. yor que paceres comer cualque tan Rocner por que manata porto Rico, esdes. en or ana mal a once.",femenina latino americana crue hatin amerian vonan surres alienen rue secreta yor que paceres comer cualque tan rocner por que manata porto rico esdes en or ana mal a once,30,0,1,-1,-0.0333333333333333,negativa,,mal
heraldo_000850,heraldo,850,mujer,mujeres,Es una gran pérdida para todas las mujeres de America.,es una gran perdida para todas las mujeres de america,10,0,1,-1,-0.1,negativa,,perdida
heraldo_000010,heraldo,10,mujer,mujer,HERALDO DE LA MUJER rrere Feres reFe FILIPINILA ANGELICINAS FARIS BAZAR.,heraldo de la mujer rrere feres refe filipinila angelicinas faris bazar,11,0,0,0,0.0,neutra,,
heraldo_000021,heraldo,21,mujer,mujer,Ayuntamiento de Madrid HERALDO DE LA MUJER QUULO JUU HIPIII.,ayuntamiento de madrid heraldo de la mujer quulo juu hipiii,10,0,0,0,0.0,neutra,,
heraldo_000033,heraldo,33,mujer,madre,En una las de un madre de umila puertorrieneno debe estar.,en una las de un madre de umila puertorrieneno debe estar,11,0,0,0,0.0,neutra,,
heraldo_000044,heraldo,44,mujer,mujer,"HERALDO DE LA MUJER Ayuntamiento de Madrid Hace el Hornear en Casa raciCon el auxilio de la ROYAL BARING POUDER se pueden hacer en casa pones y pacimente muras hermanos panecios pasata, el apreciosos y anos de tores que los que pueden comprane en las parecer.",heraldo de la mujer ayuntamiento de madrid hace el hornear en casa racicon el auxilio de la royal baring pouder se pueden hacer en casa pones y pacimente muras hermanos panecios pasata el apreciosos y anos de tores que los que pueden comprane en las parecer,46,0,0,0,0.0,neutra,,
heraldo_000049,heraldo,49,mujer,mujer,"N E HILIALDO DE LA MUEL ANTES ALBUM PUERTORRIQUENO Revista Quincenal Bilingue, Defensora de los Derechos de la Mujer DIRECTORA ADMINISTRADORA.—Ana Roqué de Duprey.",n e hilialdo de la muel antes album puertorriqueno revista quincenal bilingue defensora de los derechos de la mujer directora administradora ana roque de duprey,25,0,0,0,0.0,neutra,,
heraldo_000076,heraldo,76,mujer,mujer,Ayuntamiento de Madrid HERALDO DE LA MUJER.,ayuntamiento de madrid heraldo de la mujer,7,0,0,0,0.0,neutra,,
heraldo_000080,heraldo,80,mujer,mujeres,"Primeramente las palabras de la que presea porosas parte en derecho que tienen unos los pueblos de la era las prenta terminaciona Vicas, el misterar nuestra suncion económica. que esta bocada ponersamente de esas ma. buenaremos las espeindudablemente la guerra la presuerto el alga de los precios en los muretos de primera nuesiadpero la guerra ha terminado y el menos un han el pnero de peque las presiones que se maneparan por mar. actores que mar paratos puras las manos de empela despara Europa, pero empena punto en las una canas mujeres que de manera santenara los melas de los arrentos mas necesarios para la vida, empelamenteras.",primeramente las palabras de la que presea porosas parte en derecho que tienen unos los pueblos de la era las prenta terminaciona vicas el misterar nuestra suncion economica que esta bocada ponersamente de esas ma buenaremos las espeindudablemente la guerra la presuerto el alga de los precios en los muretos de primera nuesiadpero la guerra ha terminado y el menos un han el pnero de peque las presiones que se maneparan por mar actores que mar paratos puras las manos de empela despara europa pero empena punto en las una canas mujeres que de manera santenara los melas de los arrentos mas necesarios para la vida empelamenteras,107,2,2,0,0.0,neutra,puras; vida,guerra
heraldo_000082,heraldo,82,mujer,mujeres,"Estados que pasanos como mionarios sienas espuesto en panes puras y para mostener es gobierno lues enemos mujeres un sus cuanto namente y desuno, como los partas de la inlas pasolo engrante exaltado con precitas mal anas de espirabres que enen hace es gusto conde este en un en el purenes nerorqueno, que no tiene la cupa, y que se ve tamben por las mismas esAyuntamiento de Madrid A los Sres, epresentantes Americanos: sas, en el lecho de Procusto, y que bien podría de cile a ente pueblo puesto que lo increos, lo que muererana del e aninos enenos mernan cures los tan agan en unas para inAcaso estoy vo en un lecho de rosas? otra casa hay que pertura mucho a nuestra las: Estos los que tan terno las pronta de los Estados inlos han vinte que incistera de menin que las mercanlas en ameras pagaran sus derechos de aquena en las colorias los mue mupiera pereccion espor en en melaceres, las colores entan presamente que empre la madre para el peso que querian imponente las esporadores las merencias erraneras nos que mubiera poun compra mas paratas buenas retamente. una este mismo pas nos en pues los mien los proquctos erranterna venes de una por en empor de Emana, lo que la empranamos a la merepor los costena prepara.",estados que pasanos como mionarios sienas espuesto en panes puras y para mostener es gobierno lues enemos mujeres un sus cuanto namente y desuno como los partas de la inlas pasolo engrante exaltado con precitas mal anas de espirabres que enen hace es gusto conde este en un en el purenes nerorqueno que no tiene la cupa y que se ve tamben por las mismas esayuntamiento de madrid a los sres epresentantes americanos sas en el lecho de procusto y que bien podria de cile a ente pueblo puesto que lo increos lo que muererana del e aninos enenos mernan cures los tan agan en unas para inacaso estoy vo en un lecho de rosas otra casa hay que pertura mucho a nuestra las estos los que tan terno las pronta de los estados inlos han vinte que incistera de menin que las mercanlas en ameras pagaran sus derechos de aquena en las colorias los mue mupiera pereccion espor en en melaceres las colores entan presamente que empre la madre para el peso que querian imponente las esporadores las merencias erraneras nos que mubiera poun compra mas paratas buenas retamente una este mismo pas nos en pues los mien los proquctos erranterna venes de una por en empor de emana lo que la empranamos a la merepor los costena prepara,220,2,2,0,0.0,neutra,bien; puras,mal; peso
heraldo_000082,heraldo,82,mujer,madre,"Estados que pasanos como mionarios sienas espuesto en panes puras y para mostener es gobierno lues enemos mujeres un sus cuanto namente y desuno, como los partas de la inlas pasolo engrante exaltado con precitas mal anas de espirabres que enen hace es gusto conde este en un en el purenes nerorqueno, que no tiene la cupa, y que se ve tamben por las mismas esAyuntamiento de Madrid A los Sres, epresentantes Americanos: sas, en el lecho de Procusto, y que bien podría de cile a ente pueblo puesto que lo increos, lo que muererana del e aninos enenos mernan cures los tan agan en unas para inAcaso estoy vo en un lecho de rosas? otra casa hay que pertura mucho a nuestra las: Estos los que tan terno las pronta de los Estados inlos han vinte que incistera de menin que las mercanlas en ameras pagaran sus derechos de aquena en las colorias los mue mupiera pereccion espor en en melaceres, las colores entan presamente que empre la madre para el peso que querian imponente las esporadores las merencias erraneras nos que mubiera poun compra mas paratas buenas retamente. una este mismo pas nos en pues los mien los proquctos erranterna venes de una por en empor de Emana, lo que la empranamos a la merepor los costena prepara.",estados que pasanos como mionarios sienas espuesto en panes puras y para mostener es gobierno lues enemos mujeres un sus cuanto namente y desuno como los partas de la inlas pasolo engrante exaltado con precitas mal anas de espirabres que enen hace es gusto conde este en un en el purenes nerorqueno que no tiene la cupa y que se ve tamben por las mismas esayuntamiento de madrid a los sres epresentantes americanos sas en el lecho de procusto y que bien podria de cile a ente pueblo puesto que lo increos lo que muererana del e aninos enenos mernan cures los tan agan en unas para inacaso estoy vo en un lecho de rosas otra casa hay que pertura mucho a nuestra las estos los que tan terno las pronta de los estados inlos han vinte que incistera de menin que las mercanlas en ameras pagaran sus derechos de aquena en las colorias los mue mupiera pereccion espor en en melaceres las colores entan presamente que empre la madre para el peso que querian imponente las esporadores las merencias erraneras nos que mubiera poun compra mas paratas buenas retamente una este mismo pas nos en pues los mien los proquctos erranterna venes de una por en empor de emana lo que la empranamos a la merepor los costena prepara,220,2,2,0,0.0,neutra,bien; puras,mal; peso
heraldo_000094,heraldo,94,mujer,mujer,"Esta Señora o Señorita, representará a HERALDO DE LA MUJER en toda fiesta o acto social y público de la localidad; y, si le es posible, nos enviará unas ligeras notas de él, sin ser esto indispensable.",esta senora o senorita representara a heraldo de la mujer en toda fiesta o acto social y publico de la localidad y si le es posible nos enviara unas ligeras notas de el sin ser esto indispensable,37,0,0,0,0.0,neutra,,
heraldo_002870,heraldo,2870,mujer,mujer,"Pero el amor, y las funciones maternales de una mujer superior que sepa formar el corazón e ilustraro despertar la inteligencia de sus hijos, no se consigue con ningún dinero: es obra de la educación que se le de á la mujer, considerándola un ser pensante, como el hombre, con inteligencia, cerebro, corazón y sensatez para llevar á cabodignamente las funciones de la vida; y ser madre inspiradora, y esposa cooperadora en la obra magna, de educar una familia para el bien y el progreso de la sociedad, que es el cojunto de familias y por ende de la humanidad, que es el conjunto de sociedades esparcidas en las distintas y hermosas tierras de nuestro planeta, mundo sideral que Dios nos ha dado por morada, para que lo embellezcamos con los adelantos de una pujante civilización, y lo perfeccionemos con una vida moral y humana, que nos conduzca por los luminosos senderos del Bien y de la Ciencia; para que nuestras almas, al desprenderse de esta tierra, puedan seguir los caminos de luz por ese espacio infinito, lleno de bellezas, que de aquí vilumbramos, y que son las moradas del Padre, de que nos hablabaAna ROQUE DE DUPREY.",pero el amor y las funciones maternales de una mujer superior que sepa formar el corazon e ilustraro despertar la inteligencia de sus hijos no se consigue con ningun dinero es obra de la educacion que se le de a la mujer considerandola un ser pensante como el hombre con inteligencia cerebro corazon y sensatez para llevar a cabodignamente las funciones de la vida y ser madre inspiradora y esposa cooperadora en la obra magna de educar una familia para el bien y el progreso de la sociedad que es el cojunto de familias y por ende de la humanidad que es el conjunto de sociedades esparcidas en las distintas y hermosas tierras de nuestro planeta mundo sideral que dios nos ha dado por morada para que lo embellezcamos con los adelantos de una pujante civilizacion y lo perfeccionemos con una vida moral y humana que nos conduzca por los luminosos senderos del bien y de la ciencia para que nuestras almas al desprenderse de esta tierra puedan seguir los caminos de luz por ese espacio infinito lleno de bellezas que de aqui vilumbramos y que son las moradas del padre de que nos hablabaana roque de duprey,198,15,0,15,0.0757575757575757,positiva,amor; bien; ciencia; civilizacion; despertar; educacion; hermosas; inteligencia; luz; progreso; superior; vida,
heraldo_002870,heraldo,2870,mujer,madre,"Pero el amor, y las funciones maternales de una mujer superior que sepa formar el corazón e ilustraro despertar la inteligencia de sus hijos, no se consigue con ningún dinero: es obra de la educación que se le de á la mujer, considerándola un ser pensante, como el hombre, con inteligencia, cerebro, corazón y sensatez para llevar á cabodignamente las funciones de la vida; y ser madre inspiradora, y esposa cooperadora en la obra magna, de educar una familia para el bien y el progreso de la sociedad, que es el cojunto de familias y por ende de la humanidad, que es el conjunto de sociedades esparcidas en las distintas y hermosas tierras de nuestro planeta, mundo sideral que Dios nos ha dado por morada, para que lo embellezcamos con los adelantos de una pujante civilización, y lo perfeccionemos con una vida moral y humana, que nos conduzca por los luminosos senderos del Bien y de la Ciencia; para que nuestras almas, al desprenderse de esta tierra, puedan seguir los caminos de luz por ese espacio infinito, lleno de bellezas, que de aquí vilumbramos, y que son las moradas del Padre, de que nos hablabaAna ROQUE DE DUPREY.",pero el amor y las funciones maternales de una mujer superior que sepa formar el corazon e ilustraro despertar la inteligencia de sus hijos no se consigue con ningun dinero es obra de la educacion que se le de a la mujer considerandola un ser pensante como el hombre con inteligencia cerebro corazon y sensatez para llevar a cabodignamente las funciones de la vida y ser madre inspiradora y esposa cooperadora en la obra magna de educar una familia para el bien y el progreso de la sociedad que es el cojunto de familias y por ende de la humanidad que es el conjunto de sociedades esparcidas en las distintas y hermosas tierras de nuestro planeta mundo sideral que dios nos ha dado por morada para que lo embellezcamos con los adelantos de una pujante civilizacion y lo perfeccionemos con una vida moral y humana que nos conduzca por los luminosos senderos del bien y de la ciencia para que nuestras almas al desprenderse de esta tierra puedan seguir los caminos de luz por ese espacio infinito lleno de bellezas que de aqui vilumbramos y que son las moradas del padre de que nos hablabaana roque de duprey,198,15,0,15,0.0757575757575757,positiva,amor; bien; ciencia; civilizacion; despertar; educacion; hermosas; inteligencia; luz; progreso; superior; vida,
