sentence_id,documento,orden_frase,tema,keyword_detectada,frase_original,frase_normalizada,n_palabras
heraldo_001610,heraldo,1610,hogar,casa,"Llegados ahora por este correo, esta casa tiene un esplendido surtido de Trajes Preciosos de Corte Moderno, Telas primorosas de Crepé de China, etamina Georgette, Punto.",llegados ahora por este correo esta casa tiene un esplendido surtido de trajes preciosos de corte moderno telas primorosas de crepe de china etamina georgette punto,26
heraldo_001612,heraldo,1612,hogar,casa,"Vengan a esta casa las más bellas flores del pensil riqueño, y saldrán más bellas con tan rico atrezzo.",vengan a esta casa las mas bellas flores del pensil riqueno y saldran mas bellas con tan rico atrezzo,19
heraldo_001619,heraldo,1619,hogar,casa,LA CASA QUE VENDE LO MEJORD Ponce....,la casa que vende lo mejord ponce,7
heraldo_001620,heraldo,1620,mujer,mujer,"Mayaguez San Juan, Ayuntamiento de Madrid Heraldo de la Mujer 1919 Año II.",mayaguez san juan ayuntamiento de madrid heraldo de la mujer 1919 ano ii,13
heraldo_001622,heraldo,1622,mujer,mujer,"Trina Padilla de Sanz (La Hija del Caribe) Notable Poetisa Puertorriqueña Representante en Arecibo de ""Heraldo de la Mujer"" Tip.",trina padilla de sanz la hija del caribe notable poetisa puertorriquena representante en arecibo de heraldo de la mujer tip,20
heraldo_001634,heraldo,1634,mujer,mujer,"VENGA USTED Y LO VERA La es ros en los nos es es como es no se la no es es es es se es el mes en el cultura de la mujer, y defiende sus derechos. hombre ayudarla en tan nobles empeños. es el periódico femenino por excelencia.",venga usted y lo vera la es ros en los nos es es como es no se la no es es es es se es el mes en el cultura de la mujer y defiende sus derechos hombre ayudarla en tan nobles empenos es el periodico femenino por excelencia,49
heraldo_001634,heraldo,1634,mujer,femenino,"VENGA USTED Y LO VERA La es ros en los nos es es como es no se la no es es es es se es el mes en el cultura de la mujer, y defiende sus derechos. hombre ayudarla en tan nobles empeños. es el periódico femenino por excelencia.",venga usted y lo vera la es ros en los nos es es como es no se la no es es es es se es el mes en el cultura de la mujer y defiende sus derechos hombre ayudarla en tan nobles empenos es el periodico femenino por excelencia,49
heraldo_001634,heraldo,1634,educacion,cultura,"VENGA USTED Y LO VERA La es ros en los nos es es como es no se la no es es es es se es el mes en el cultura de la mujer, y defiende sus derechos. hombre ayudarla en tan nobles empeños. es el periódico femenino por excelencia.",venga usted y lo vera la es ros en los nos es es como es no se la no es es es es se es el mes en el cultura de la mujer y defiende sus derechos hombre ayudarla en tan nobles empenos es el periodico femenino por excelencia,49
heraldo_001635,heraldo,1635,mujer,mujer,"El visita los ""Heraldo de la Mujer y hogares de las mujeres más cultas, y de los hombres más ilustrados.",el visita los heraldo de la mujer y hogares de las mujeres mas cultas y de los hombres mas ilustrados,20
heraldo_001635,heraldo,1635,mujer,mujeres,"El visita los ""Heraldo de la Mujer y hogares de las mujeres más cultas, y de los hombres más ilustrados.",el visita los heraldo de la mujer y hogares de las mujeres mas cultas y de los hombres mas ilustrados,20
heraldo_001639,heraldo,1639,mujer,femenino,"VELLOS en el cutis, los cuales como es muy sabido afean potablemente el rostro femenino.",vellos en el cutis los cuales como es muy sabido afean potablemente el rostro femenino,15
heraldo_001640,heraldo,1640,raza,razas,"Debido al gran exito que hemos alcanzado con nuestra Pamada Cutánea Si su farmacéntico no tiene la Pomada 2ELITA Y Una LLLA ELITA en la curación de las pecas y manchas del cuis han emperado va a lanzarse al mercado mucha IACIONES de muesto producto con nombres más menos supesivos, pero en beneficio de nuestra numeroso cientela nos apresuramos a advertirle que no acepta bajo ningún concento suros de nuestra Ayuntamiento de Madrid Compre en la bodega una lata de LEVADURA EN POLVO HAPAL la famosa Roval Baking Ponder americana. y pruebe la siguiente receta: TORTA DE CAFE a razas de harina encharadas de mantequila amnas de saFILES arenas de santaRE.",debido al gran exito que hemos alcanzado con nuestra pamada cutanea si su farmacentico no tiene la pomada 2elita y una llla elita en la curacion de las pecas y manchas del cuis han emperado va a lanzarse al mercado mucha iaciones de muesto producto con nombres mas menos supesivos pero en beneficio de nuestra numeroso cientela nos apresuramos a advertirle que no acepta bajo ningun concento suros de nuestra ayuntamiento de madrid compre en la bodega una lata de levadura en polvo hapal la famosa roval baking ponder americana y pruebe la siguiente receta torta de cafe a razas de harina encharadas de mantequila amnas de safiles arenas de santare,111
heraldo_001641,heraldo,1641,mujer,mujer,SRTARA LA FORDER meniene y semanse los rente seos anadas la arre una manues la ner en eserne mana esa para macas na mujer aque sea que es una bre.,srtara la forder meniene y semanse los rente seos anadas la arre una manues la ner en eserne mana esa para macas na mujer aque sea que es una bre,30
heraldo_001661,heraldo,1661,mujer,mujer,Este anuncio lo publica gas HERALDO DE LA MUJER Advto Ayuntamiento de Madrid III.,este anuncio lo publica gas heraldo de la mujer advto ayuntamiento de madrid iii,14
heraldo_001662,heraldo,1662,mujer,mujer,Revista Mensual defensora de los derechos de la mujer.,revista mensual defensora de los derechos de la mujer,9
heraldo_001662,heraldo,1662,feminismo,derechos de la mujer,Revista Mensual defensora de los derechos de la mujer.,revista mensual defensora de los derechos de la mujer,9
heraldo_001673,heraldo,1673,mujer,mujer,LA MUJER ERANCESA.....,la mujer erancesa,3
heraldo_001677,heraldo,1677,mujer,mujer,LA MUJER DEL SIGLO VEINTE...........................,la mujer del siglo veinte,5
heraldo_001680,heraldo,1680,mujer,mujeres,LAS MUJERES Y LAS FLORES...............,las mujeres y las flores,5
heraldo_001687,heraldo,1687,mujer,mujer,"HERALDO DE LA MUJER las meC. era en ante Quisiera ser hada, quisiera ser hada de los tiempos viejos an honras malentes prorecas y raras de hora que quina transtormar mi cuerpo a pobre una palma verde regiante de morabres rutos palancarme, y luego tener en es otras venerables puras, bajo en penacio el quido reseo. quiera er nada quiera ser nada de los empos vieos.",heraldo de la mujer las mec era en ante quisiera ser hada quisiera ser hada de los tiempos viejos an honras malentes prorecas y raras de hora que quina transtormar mi cuerpo a pobre una palma verde regiante de morabres rutos palancarme y luego tener en es otras venerables puras bajo en penacio el quido reseo quiera er nada quiera ser nada de los empos vieos,66
heraldo_001688,heraldo,1688,educacion,escuela,Quisiera volverme heroico soldado y entrar en batalla vibrando el acero. arre las crines del real penso que pertos que del clarin atento. un para nerines plareando el arte de polvora armente siguiento un reguer porando ruroso sobre sus aciones aquel ue sus lomos oprime abenio mientes sene la escuela de para horadar sus inres sin miedo. quistera ser hada quiera se hada de los viempos vicios.,quisiera volverme heroico soldado y entrar en batalla vibrando el acero arre las crines del real penso que pertos que del clarin atento un para nerines plareando el arte de polvora armente siguiento un reguer porando ruroso sobre sus aciones aquel ue sus lomos oprime abenio mientes sene la escuela de para horadar sus inres sin miedo quistera ser hada quiera se hada de los viempos vicios,67
heraldo_001689,heraldo,1689,raza,negra,"Quisiera del tiempo salvando centurias vivir en los días de los galanteos y en mi amberes milado de pluma que el veno amoroso defina á sus besos ha ana rerciada mi negra ciona mis alas polanas mis ancios presescos tras la ppila bordada de pro mirar aburarse el rigido aceros. buscando amoras cruzar calcuelas en pos de aventuras lances don juaneros, vala enta ala muere escalar las rapias de algin pledos pacitos querio. bustera ser hada quiera ser hada de los tiempos vicios.",quisiera del tiempo salvando centurias vivir en los dias de los galanteos y en mi amberes milado de pluma que el veno amoroso defina a sus besos ha ana rerciada mi negra ciona mis alas polanas mis ancios presescos tras la ppila bordada de pro mirar aburarse el rigido aceros buscando amoras cruzar calcuelas en pos de aventuras lances don juaneros vala enta ala muere escalar las rapias de algin pledos pacitos querio bustera ser hada quiera ser hada de los tiempos vicios,83
heraldo_001693,heraldo,1693,mujer,mujer,Ayuntamiento de Madrid HERALDO DE LA MUJER.,ayuntamiento de madrid heraldo de la mujer,7
heraldo_001696,heraldo,1696,feminismo,feminismo,El feminismo se impone.,el feminismo se impone,4
heraldo_001697,heraldo,1697,mujer,mujer,"Aver Italia, y Estados Unidos hacen justicia á la mujer.",aver italia y estados unidos hacen justicia a la mujer,10
heraldo_001697,heraldo,1697,colonialismo,estados unidos,"Aver Italia, y Estados Unidos hacen justicia á la mujer.",aver italia y estados unidos hacen justicia a la mujer,10
heraldo_001700,heraldo,1700,mujer,mujer,"Y resuelta la legendaria España, a marchar porma via de progreso posito concede el derecho de sufrago sus mujeres, sin lucha cas por parte de estas: por un rego noble y humano de un gobierno periorpudente el cual considerando que actuar contra las orientes de la enen ena atraer el derrento más caperlo sobre su nación tomo la via quella del progreso. prefriendo nuralor con al que suilarse en la enerosa noche del engerresmo y la mulación. pen por nuestra Male atorta. quien hubiera crello que en los Estados Unidos habria, tenido que hallar la mujer como herina para tener el rentamiento de s dereno, durante encuenta años y en mamaña lo consiguiera en un minto: Lección hermosa que ha dado la patria genial de Ladel la Catolea, a la poderosa nación que se enoranno en hamare cuna de la Libertad y estandarte de la penorra del mundo.",y resuelta la legendaria espana a marchar porma via de progreso posito concede el derecho de sufrago sus mujeres sin lucha cas por parte de estas por un rego noble y humano de un gobierno periorpudente el cual considerando que actuar contra las orientes de la enen ena atraer el derrento mas caperlo sobre su nacion tomo la via quella del progreso prefriendo nuralor con al que suilarse en la enerosa noche del engerresmo y la mulacion pen por nuestra male atorta quien hubiera crello que en los estados unidos habria tenido que hallar la mujer como herina para tener el rentamiento de s dereno durante encuenta anos y en mamana lo consiguiera en un minto leccion hermosa que ha dado la patria genial de ladel la catolea a la poderosa nacion que se enoranno en hamare cuna de la libertad y estandarte de la penorra del mundo,148
heraldo_001700,heraldo,1700,mujer,mujeres,"Y resuelta la legendaria España, a marchar porma via de progreso posito concede el derecho de sufrago sus mujeres, sin lucha cas por parte de estas: por un rego noble y humano de un gobierno periorpudente el cual considerando que actuar contra las orientes de la enen ena atraer el derrento más caperlo sobre su nación tomo la via quella del progreso. prefriendo nuralor con al que suilarse en la enerosa noche del engerresmo y la mulación. pen por nuestra Male atorta. quien hubiera crello que en los Estados Unidos habria, tenido que hallar la mujer como herina para tener el rentamiento de s dereno, durante encuenta años y en mamaña lo consiguiera en un minto: Lección hermosa que ha dado la patria genial de Ladel la Catolea, a la poderosa nación que se enoranno en hamare cuna de la Libertad y estandarte de la penorra del mundo.",y resuelta la legendaria espana a marchar porma via de progreso posito concede el derecho de sufrago sus mujeres sin lucha cas por parte de estas por un rego noble y humano de un gobierno periorpudente el cual considerando que actuar contra las orientes de la enen ena atraer el derrento mas caperlo sobre su nacion tomo la via quella del progreso prefriendo nuralor con al que suilarse en la enerosa noche del engerresmo y la mulacion pen por nuestra male atorta quien hubiera crello que en los estados unidos habria tenido que hallar la mujer como herina para tener el rentamiento de s dereno durante encuenta anos y en mamana lo consiguiera en un minto leccion hermosa que ha dado la patria genial de ladel la catolea a la poderosa nacion que se enoranno en hamare cuna de la libertad y estandarte de la penorra del mundo,148
heraldo_001700,heraldo,1700,patria,patria,"Y resuelta la legendaria España, a marchar porma via de progreso posito concede el derecho de sufrago sus mujeres, sin lucha cas por parte de estas: por un rego noble y humano de un gobierno periorpudente el cual considerando que actuar contra las orientes de la enen ena atraer el derrento más caperlo sobre su nación tomo la via quella del progreso. prefriendo nuralor con al que suilarse en la enerosa noche del engerresmo y la mulación. pen por nuestra Male atorta. quien hubiera crello que en los Estados Unidos habria, tenido que hallar la mujer como herina para tener el rentamiento de s dereno, durante encuenta años y en mamaña lo consiguiera en un minto: Lección hermosa que ha dado la patria genial de Ladel la Catolea, a la poderosa nación que se enoranno en hamare cuna de la Libertad y estandarte de la penorra del mundo.",y resuelta la legendaria espana a marchar porma via de progreso posito concede el derecho de sufrago sus mujeres sin lucha cas por parte de estas por un rego noble y humano de un gobierno periorpudente el cual considerando que actuar contra las orientes de la enen ena atraer el derrento mas caperlo sobre su nacion tomo la via quella del progreso prefriendo nuralor con al que suilarse en la enerosa noche del engerresmo y la mulacion pen por nuestra male atorta quien hubiera crello que en los estados unidos habria tenido que hallar la mujer como herina para tener el rentamiento de s dereno durante encuenta anos y en mamana lo consiguiera en un minto leccion hermosa que ha dado la patria genial de ladel la catolea a la poderosa nacion que se enoranno en hamare cuna de la libertad y estandarte de la penorra del mundo,148
heraldo_001700,heraldo,1700,patria,nación,"Y resuelta la legendaria España, a marchar porma via de progreso posito concede el derecho de sufrago sus mujeres, sin lucha cas por parte de estas: por un rego noble y humano de un gobierno periorpudente el cual considerando que actuar contra las orientes de la enen ena atraer el derrento más caperlo sobre su nación tomo la via quella del progreso. prefriendo nuralor con al que suilarse en la enerosa noche del engerresmo y la mulación. pen por nuestra Male atorta. quien hubiera crello que en los Estados Unidos habria, tenido que hallar la mujer como herina para tener el rentamiento de s dereno, durante encuenta años y en mamaña lo consiguiera en un minto: Lección hermosa que ha dado la patria genial de Ladel la Catolea, a la poderosa nación que se enoranno en hamare cuna de la Libertad y estandarte de la penorra del mundo.",y resuelta la legendaria espana a marchar porma via de progreso posito concede el derecho de sufrago sus mujeres sin lucha cas por parte de estas por un rego noble y humano de un gobierno periorpudente el cual considerando que actuar contra las orientes de la enen ena atraer el derrento mas caperlo sobre su nacion tomo la via quella del progreso prefriendo nuralor con al que suilarse en la enerosa noche del engerresmo y la mulacion pen por nuestra male atorta quien hubiera crello que en los estados unidos habria tenido que hallar la mujer como herina para tener el rentamiento de s dereno durante encuenta anos y en mamana lo consiguiera en un minto leccion hermosa que ha dado la patria genial de ladel la catolea a la poderosa nacion que se enoranno en hamare cuna de la libertad y estandarte de la penorra del mundo,148
heraldo_001700,heraldo,1700,colonialismo,estados unidos,"Y resuelta la legendaria España, a marchar porma via de progreso posito concede el derecho de sufrago sus mujeres, sin lucha cas por parte de estas: por un rego noble y humano de un gobierno periorpudente el cual considerando que actuar contra las orientes de la enen ena atraer el derrento más caperlo sobre su nación tomo la via quella del progreso. prefriendo nuralor con al que suilarse en la enerosa noche del engerresmo y la mulación. pen por nuestra Male atorta. quien hubiera crello que en los Estados Unidos habria, tenido que hallar la mujer como herina para tener el rentamiento de s dereno, durante encuenta años y en mamaña lo consiguiera en un minto: Lección hermosa que ha dado la patria genial de Ladel la Catolea, a la poderosa nación que se enoranno en hamare cuna de la Libertad y estandarte de la penorra del mundo.",y resuelta la legendaria espana a marchar porma via de progreso posito concede el derecho de sufrago sus mujeres sin lucha cas por parte de estas por un rego noble y humano de un gobierno periorpudente el cual considerando que actuar contra las orientes de la enen ena atraer el derrento mas caperlo sobre su nacion tomo la via quella del progreso prefriendo nuralor con al que suilarse en la enerosa noche del engerresmo y la mulacion pen por nuestra male atorta quien hubiera crello que en los estados unidos habria tenido que hallar la mujer como herina para tener el rentamiento de s dereno durante encuenta anos y en mamana lo consiguiera en un minto leccion hermosa que ha dado la patria genial de ladel la catolea a la poderosa nacion que se enoranno en hamare cuna de la libertad y estandarte de la penorra del mundo,148
heraldo_001701,heraldo,1701,mujer,mujer,"¿Y qué pensará de todo esto Puerto Rico Hija de remana, esta ala gentil, cuando esperibamos que tre el pormestandarte de toda la america Latina 10 nos ha realado un solo, conmejo, que se econde ente los macios de cañas de sus campos mundoleal replandor que se dotra de sus dos metrones, la muria Espana y la moderna patria de malisten la lantente ante la en vante sus cinas progresita. pares muestra ila internada, como la cenizas del tento envuelta en la negra de sus penicios, y polada por una generación masculio y femenina en su mavoria quena hila en este repeto del sigo y de la mas cristiana con todas sus aleraciones precios y precipaciones que la ya ueno se hundieron en la voen sombra de los esa ilo. de las cuales, miel puertos queran conservar los hombres humanos y poguistas de mura.... pien nos dijo con profundo dolor de su alma Maroz muen en la lina carta que nos acrios pesenañese, doña Ana, la mujer de nuestra infortunada tierra en estículo mor mara el reconocimiento de sus deralos Esta inbrilla en prejuicios maestras nos umbrado al deprimente estado de utoriorida en que la rudo su protesta tantos salo.",y que pensara de todo esto puerto rico hija de remana esta ala gentil cuando esperibamos que tre el pormestandarte de toda la america latina 10 nos ha realado un solo conmejo que se econde ente los macios de canas de sus campos mundoleal replandor que se dotra de sus dos metrones la muria espana y la moderna patria de malisten la lantente ante la en vante sus cinas progresita pares muestra ila internada como la cenizas del tento envuelta en la negra de sus penicios y polada por una generacion masculio y femenina en su mavoria quena hila en este repeto del sigo y de la mas cristiana con todas sus aleraciones precios y precipaciones que la ya ueno se hundieron en la voen sombra de los esa ilo de las cuales miel puertos queran conservar los hombres humanos y poguistas de mura pien nos dijo con profundo dolor de su alma maroz muen en la lina carta que nos acrios pesenanese dona ana la mujer de nuestra infortunada tierra en esticulo mor mara el reconocimiento de sus deralos esta inbrilla en prejuicios maestras nos umbrado al deprimente estado de utoriorida en que la rudo su protesta tantos salo,200
heraldo_001701,heraldo,1701,mujer,femenina,"¿Y qué pensará de todo esto Puerto Rico Hija de remana, esta ala gentil, cuando esperibamos que tre el pormestandarte de toda la america Latina 10 nos ha realado un solo, conmejo, que se econde ente los macios de cañas de sus campos mundoleal replandor que se dotra de sus dos metrones, la muria Espana y la moderna patria de malisten la lantente ante la en vante sus cinas progresita. pares muestra ila internada, como la cenizas del tento envuelta en la negra de sus penicios, y polada por una generación masculio y femenina en su mavoria quena hila en este repeto del sigo y de la mas cristiana con todas sus aleraciones precios y precipaciones que la ya ueno se hundieron en la voen sombra de los esa ilo. de las cuales, miel puertos queran conservar los hombres humanos y poguistas de mura.... pien nos dijo con profundo dolor de su alma Maroz muen en la lina carta que nos acrios pesenañese, doña Ana, la mujer de nuestra infortunada tierra en estículo mor mara el reconocimiento de sus deralos Esta inbrilla en prejuicios maestras nos umbrado al deprimente estado de utoriorida en que la rudo su protesta tantos salo.",y que pensara de todo esto puerto rico hija de remana esta ala gentil cuando esperibamos que tre el pormestandarte de toda la america latina 10 nos ha realado un solo conmejo que se econde ente los macios de canas de sus campos mundoleal replandor que se dotra de sus dos metrones la muria espana y la moderna patria de malisten la lantente ante la en vante sus cinas progresita pares muestra ila internada como la cenizas del tento envuelta en la negra de sus penicios y polada por una generacion masculio y femenina en su mavoria quena hila en este repeto del sigo y de la mas cristiana con todas sus aleraciones precios y precipaciones que la ya ueno se hundieron en la voen sombra de los esa ilo de las cuales miel puertos queran conservar los hombres humanos y poguistas de mura pien nos dijo con profundo dolor de su alma maroz muen en la lina carta que nos acrios pesenanese dona ana la mujer de nuestra infortunada tierra en esticulo mor mara el reconocimiento de sus deralos esta inbrilla en prejuicios maestras nos umbrado al deprimente estado de utoriorida en que la rudo su protesta tantos salo,200
heraldo_001701,heraldo,1701,patria,patria,"¿Y qué pensará de todo esto Puerto Rico Hija de remana, esta ala gentil, cuando esperibamos que tre el pormestandarte de toda la america Latina 10 nos ha realado un solo, conmejo, que se econde ente los macios de cañas de sus campos mundoleal replandor que se dotra de sus dos metrones, la muria Espana y la moderna patria de malisten la lantente ante la en vante sus cinas progresita. pares muestra ila internada, como la cenizas del tento envuelta en la negra de sus penicios, y polada por una generación masculio y femenina en su mavoria quena hila en este repeto del sigo y de la mas cristiana con todas sus aleraciones precios y precipaciones que la ya ueno se hundieron en la voen sombra de los esa ilo. de las cuales, miel puertos queran conservar los hombres humanos y poguistas de mura.... pien nos dijo con profundo dolor de su alma Maroz muen en la lina carta que nos acrios pesenañese, doña Ana, la mujer de nuestra infortunada tierra en estículo mor mara el reconocimiento de sus deralos Esta inbrilla en prejuicios maestras nos umbrado al deprimente estado de utoriorida en que la rudo su protesta tantos salo.",y que pensara de todo esto puerto rico hija de remana esta ala gentil cuando esperibamos que tre el pormestandarte de toda la america latina 10 nos ha realado un solo conmejo que se econde ente los macios de canas de sus campos mundoleal replandor que se dotra de sus dos metrones la muria espana y la moderna patria de malisten la lantente ante la en vante sus cinas progresita pares muestra ila internada como la cenizas del tento envuelta en la negra de sus penicios y polada por una generacion masculio y femenina en su mavoria quena hila en este repeto del sigo y de la mas cristiana con todas sus aleraciones precios y precipaciones que la ya ueno se hundieron en la voen sombra de los esa ilo de las cuales miel puertos queran conservar los hombres humanos y poguistas de mura pien nos dijo con profundo dolor de su alma maroz muen en la lina carta que nos acrios pesenanese dona ana la mujer de nuestra infortunada tierra en esticulo mor mara el reconocimiento de sus deralos esta inbrilla en prejuicios maestras nos umbrado al deprimente estado de utoriorida en que la rudo su protesta tantos salo,200
