sentence_id,documento,orden_frase,tema,keyword_detectada,frase_original,frase_normalizada,n_palabras
heraldo_002281,heraldo,2281,mujer,mujer,"No habiendo restricción de sexo, es claro que prevalece la regla del derecho romano esto es que al decir hombre comprende así mismo a la mujer, por una apli cación del Digesto: ""Hoc verbum si quis tan masculos quam femina completictur"".",no habiendo restriccion de sexo es claro que prevalece la regla del derecho romano esto es que al decir hombre comprende asi mismo a la mujer por una apli cacion del digesto hoc verbum si quis tan masculos quam femina completictur,41
heraldo_002282,heraldo,2282,mujer,mujer,"Si una mujer es una ciudadana, siendo mayor de 21 años, sabiendo leer y escribir y teniendo una residencia legal, no puede dejar de ser capaz de votar o ser votada, a no ser que se reforme la Constitución para no ser violada. (1) Ahora hay que reconocer lo que es evidente: La aplicación de esa ley, vendría a alterar habitos establecidos y perturbar métodos electorales ya automaticos.",si una mujer es una ciudadana siendo mayor de 21 anos sabiendo leer y escribir y teniendo una residencia legal no puede dejar de ser capaz de votar o ser votada a no ser que se reforme la constitucion para no ser violada 1 ahora hay que reconocer lo que es evidente la aplicacion de esa ley vendria a alterar habitos establecidos y perturbar metodos electorales ya automaticos,68
heraldo_002283,heraldo,2283,mujer,femenino,El electorado femenino sería una novedad que los jefes de partido deberían de estudiar.,el electorado femenino seria una novedad que los jefes de partido deberian de estudiar,14
heraldo_002287,heraldo,2287,mujer,mujer,"De ahí los sufismas sobre la fragilidad del sexo, y sobre la exclusiva vocación de la mujer. para ser esclava del hombre.",de ahi los sufismas sobre la fragilidad del sexo y sobre la exclusiva vocacion de la mujer para ser esclava del hombre,22
heraldo_002288,heraldo,2288,mujer,femenina,"Y dice la Revista Femenina del Brasil: ""Con qué alegría podemos proclamar que el feminismo que no está enteramente victorioso en todas las grandes civilizaciones mundiales, comiena a interesar a algunos de nuestros grandes pensadores.",y dice la revista femenina del brasil con que alegria podemos proclamar que el feminismo que no esta enteramente victorioso en todas las grandes civilizaciones mundiales comiena a interesar a algunos de nuestros grandes pensadores,35
heraldo_002288,heraldo,2288,feminismo,feminismo,"Y dice la Revista Femenina del Brasil: ""Con qué alegría podemos proclamar que el feminismo que no está enteramente victorioso en todas las grandes civilizaciones mundiales, comiena a interesar a algunos de nuestros grandes pensadores.",y dice la revista femenina del brasil con que alegria podemos proclamar que el feminismo que no esta enteramente victorioso en todas las grandes civilizaciones mundiales comiena a interesar a algunos de nuestros grandes pensadores,35
heraldo_002289,heraldo,2289,feminismo,feministas,"Augusto de Lima que es un gran poeta, un granjefe de estado, un académico insigne, un parlamentario y un filósofo, acaba de exponer las causas de las reivindicaciones feministas en el artículo que nos permitimos transcribir.",augusto de lima que es un gran poeta un granjefe de estado un academico insigne un parlamentario y un filosofo acaba de exponer las causas de las reivindicaciones feministas en el articulo que nos permitimos transcribir,36
heraldo_002300,heraldo,2300,feminismo,feministas,"Bilact lo proclama el mejor de nuestros cantores: y por todo eso deben rejubilarse las feministas con su adhesión, pues es un gran pensador que se pone a nuestro lado en la hora de los reivindicaciones y de la justicia.",bilact lo proclama el mejor de nuestros cantores y por todo eso deben rejubilarse las feministas con su adhesion pues es un gran pensador que se pone a nuestro lado en la hora de los reivindicaciones y de la justicia,40
heraldo_002302,heraldo,2302,mujer,mujer,"Ayuntamiento de Madrid HERALDO DE LA MUJER PLUMAZOS EL FIN DEL MUNDO Pasó el susto sí, señores, y el mundo sin cesar navera por el piélago inmenso del vacío.",ayuntamiento de madrid heraldo de la mujer plumazos el fin del mundo paso el susto si senores y el mundo sin cesar navera por el pielago inmenso del vacio,29
heraldo_002307,heraldo,2307,patria,pueblo,"Para otro portorriqueño ¡qué ha de saber! Todas aquí miden por el rasero de su ignorancia los que la tienen á los demás.¬ No hay pueblo en la tierra que menos se aprecie, ni que tenga de sí propio un concepto más depresivo y fatal Así anda él ...",para otro portorriqueno que ha de saber todas aqui miden por el rasero de su ignorancia los que la tienen a los demas no hay pueblo en la tierra que menos se aprecie ni que tenga de si propio un concepto mas depresivo y fatal asi anda el,48
heraldo_002308,heraldo,2308,patria,pueblo,"¿Quién ha de estimar á un pueblo que empieza por menospreciarse a sí mismo que carece de civismo y de patrio orgullo además? Y si alguno suele elevarse sobre el estúpido montón, con qué premura los necios tratan de aplastarlo, de fustigarlo, de aislarlo para que no deslumbre al ramplón..",quien ha de estimar a un pueblo que empieza por menospreciarse a si mismo que carece de civismo y de patrio orgullo ademas y si alguno suele elevarse sobre el estupido monton con que premura los necios tratan de aplastarlo de fustigarlo de aislarlo para que no deslumbre al ramplon,50
heraldo_002310,heraldo,2310,religion,dios,"Pero mientras vive ¡Dios soberano! Todas las medianías temen la sombra que proyecta el que vale, y ras, ras palos con él hasta anularle.",pero mientras vive dios soberano todas las medianias temen la sombra que proyecta el que vale y ras ras palos con el hasta anularle,24
heraldo_002311,heraldo,2311,patria,pueblo,"Se acepta del monigote extraniero hasta el disparate y elevan hasta los cumbres todo dislate que diga un Mister o un Monsieur, catedrático del Instituto del Nosaber Pobre pueblo nuestro si así persiste, siempre serás un Nadie.",se acepta del monigote extraniero hasta el disparate y elevan hasta los cumbres todo dislate que diga un mister o un monsieur catedratico del instituto del nosaber pobre pueblo nuestro si asi persiste siempre seras un nadie,37
heraldo_002326,heraldo,2326,mujer,mujer,"Velez % ""National Casch Register Cº"" (Este anuncio lo publica gratis EL HERALDO DE LA MUJER.) Advt.",velez national casch register c este anuncio lo publica gratis el heraldo de la mujer advt,16
heraldo_002327,heraldo,2327,hogar,casa,Lo mas necesario en su casa ES UN BUEN EQUIPO DE COCINA LE FRECEMOS LO MAS MODERNO EN ESTE RAMO.,lo mas necesario en su casa es un buen equipo de cocina le frecemos lo mas moderno en este ramo,20
heraldo_002333,heraldo,2333,mujer,mujer,"O e 923 9219 HERALDO DE LA MUJER LOS PATRONES SE VENDEN EN LA CASA DE VILLAMIL SAN JUAN, PUERTO RICO Ayuntamiento de Madrid F.",o e 923 9219 heraldo de la mujer los patrones se venden en la casa de villamil san juan puerto rico ayuntamiento de madrid f,25
heraldo_002333,heraldo,2333,hogar,casa,"O e 923 9219 HERALDO DE LA MUJER LOS PATRONES SE VENDEN EN LA CASA DE VILLAMIL SAN JUAN, PUERTO RICO Ayuntamiento de Madrid F.",o e 923 9219 heraldo de la mujer los patrones se venden en la casa de villamil san juan puerto rico ayuntamiento de madrid f,25
heraldo_002334,heraldo,2334,hogar,casa,"SCra á coSan Francisco Esquina San lusto, llegados ahora por este correo, esta casa tiene un esplendido surtido de frajes preciosos de Corte Moderno.",scra a cosan francisco esquina san lusto llegados ahora por este correo esta casa tiene un esplendido surtido de frajes preciosos de corte moderno,24
heraldo_002337,heraldo,2337,hogar,casa,"Vengan a esta casa las más bellas flores del pensil riqueño, y saldrán más bellas con tan rico atrerzo.",vengan a esta casa las mas bellas flores del pensil riqueno y saldran mas bellas con tan rico atrerzo,19
heraldo_002349,heraldo,2349,mujer,mujer,"Mayaguez Ayuntamiento de Madrid N Nul la s la La cultura de un pueblo no se aprecia por el número de sus profesionales sino por la educación de las masos por sa humanismo, se repuenancia al vicio, su amor al trabajo y respeto a las lores la mujer y a los ancianos.",mayaguez ayuntamiento de madrid n nul la s la la cultura de un pueblo no se aprecia por el numero de sus profesionales sino por la educacion de las masos por sa humanismo se repuenancia al vicio su amor al trabajo y respeto a las lores la mujer y a los ancianos,52
heraldo_002349,heraldo,2349,patria,pueblo,"Mayaguez Ayuntamiento de Madrid N Nul la s la La cultura de un pueblo no se aprecia por el número de sus profesionales sino por la educación de las masos por sa humanismo, se repuenancia al vicio, su amor al trabajo y respeto a las lores la mujer y a los ancianos.",mayaguez ayuntamiento de madrid n nul la s la la cultura de un pueblo no se aprecia por el numero de sus profesionales sino por la educacion de las masos por sa humanismo se repuenancia al vicio su amor al trabajo y respeto a las lores la mujer y a los ancianos,52
heraldo_002349,heraldo,2349,educacion,educación,"Mayaguez Ayuntamiento de Madrid N Nul la s la La cultura de un pueblo no se aprecia por el número de sus profesionales sino por la educación de las masos por sa humanismo, se repuenancia al vicio, su amor al trabajo y respeto a las lores la mujer y a los ancianos.",mayaguez ayuntamiento de madrid n nul la s la la cultura de un pueblo no se aprecia por el numero de sus profesionales sino por la educacion de las masos por sa humanismo se repuenancia al vicio su amor al trabajo y respeto a las lores la mujer y a los ancianos,52
heraldo_002349,heraldo,2349,educacion,cultura,"Mayaguez Ayuntamiento de Madrid N Nul la s la La cultura de un pueblo no se aprecia por el número de sus profesionales sino por la educación de las masos por sa humanismo, se repuenancia al vicio, su amor al trabajo y respeto a las lores la mujer y a los ancianos.",mayaguez ayuntamiento de madrid n nul la s la la cultura de un pueblo no se aprecia por el numero de sus profesionales sino por la educacion de las masos por sa humanismo se repuenancia al vicio su amor al trabajo y respeto a las lores la mujer y a los ancianos,52
heraldo_002350,heraldo,2350,religion,moral,"Sa entura moral por su puntualidad en todas ocasiones, por el eruto umpimiento de la palabra dada y el amor a la verdad, cualidades preciosos que son Senos reladores de una gran honrar.",sa entura moral por su puntualidad en todas ocasiones por el eruto umpimiento de la palabra dada y el amor a la verdad cualidades preciosos que son senos reladores de una gran honrar,33
heraldo_002351,heraldo,2351,mujer,mujer,"Pero para aquilatar si un pueblo es progresista, veamos si la mujer vive penda costumbres y prenicos estales o si murela valiente y decidida por la neguras via de la inca moderna que ense de ella nervidad, desión, amor al suno y al trabajo, y rina nersolada en medio de truino de la vida, cumpiendo sus deberes ciudadanos y no, erostamente eneral, entre ento puedes.",pero para aquilatar si un pueblo es progresista veamos si la mujer vive penda costumbres y prenicos estales o si murela valiente y decidida por la neguras via de la inca moderna que ense de ella nervidad desion amor al suno y al trabajo y rina nersolada en medio de truino de la vida cumpiendo sus deberes ciudadanos y no erostamente eneral entre ento puedes,65
heraldo_002351,heraldo,2351,patria,pueblo,"Pero para aquilatar si un pueblo es progresista, veamos si la mujer vive penda costumbres y prenicos estales o si murela valiente y decidida por la neguras via de la inca moderna que ense de ella nervidad, desión, amor al suno y al trabajo, y rina nersolada en medio de truino de la vida, cumpiendo sus deberes ciudadanos y no, erostamente eneral, entre ento puedes.",pero para aquilatar si un pueblo es progresista veamos si la mujer vive penda costumbres y prenicos estales o si murela valiente y decidida por la neguras via de la inca moderna que ense de ella nervidad desion amor al suno y al trabajo y rina nersolada en medio de truino de la vida cumpiendo sus deberes ciudadanos y no erostamente eneral entre ento puedes,65
heraldo_002352,heraldo,2352,mujer,mujer,"En en el ni para á misma, mi para los demás No es solo la misión de la mujer ser micina reproductora, insula mujea de pacita ni posotra ma de lavos Necario es algo de co, pero no el todo.",en en el ni para a misma mi para los demas no es solo la mision de la mujer ser micina reproductora insula mujea de pacita ni posotra ma de lavos necario es algo de co pero no el todo,40
heraldo_002353,heraldo,2353,mujer,mujer,"Comprende tu misión mujer aliento, en tu alma los grandes ideales de la Rumanidad.",comprende tu mision mujer aliento en tu alma los grandes ideales de la rumanidad,14
heraldo_002354,heraldo,2354,religion,dios,"Nutre tu cerebro con los grandes conocimientos humanos, que nos van llevado a la revelación de Dios y de la vida.",nutre tu cerebro con los grandes conocimientos humanos que nos van llevado a la revelacion de dios y de la vida,21
heraldo_002356,heraldo,2356,mujer,mujer,"No desoigas, mujer, la llamada de la Civilización, que ha llegado la hora de las reivindicaciones sociales, y un eres un factor de ellas.",no desoigas mujer la llamada de la civilizacion que ha llegado la hora de las reivindicaciones sociales y un eres un factor de ellas,24
heraldo_002369,heraldo,2369,mujer,mujer,"HERALDO DE LA MUJER"", es el periódico femenino por excelencia.",heraldo de la mujer es el periodico femenino por excelencia,10
heraldo_002369,heraldo,2369,mujer,femenino,"HERALDO DE LA MUJER"", es el periódico femenino por excelencia.",heraldo de la mujer es el periodico femenino por excelencia,10
heraldo_002370,heraldo,2370,mujer,mujeres,"El visira los hogares de las mujeres más cultas, y de los hombres más ilustrados.",el visira los hogares de las mujeres mas cultas y de los hombres mas ilustrados,15
heraldo_002371,heraldo,2371,mujer,mujer,"Toda puertorriqueña debe ser suscripcora del periódico que coadyuva a la cultura de la mujer, y defiende sus derechos.",toda puertorriquena debe ser suscripcora del periodico que coadyuva a la cultura de la mujer y defiende sus derechos,19
heraldo_002371,heraldo,2371,educacion,cultura,"Toda puertorriqueña debe ser suscripcora del periódico que coadyuva a la cultura de la mujer, y defiende sus derechos.",toda puertorriquena debe ser suscripcora del periodico que coadyuva a la cultura de la mujer y defiende sus derechos,19
heraldo_002372,heraldo,2372,mujer,mujer,Es deber de la mujer moderna ilustrarse y vivir con su época y con su siglo.,es deber de la mujer moderna ilustrarse y vivir con su epoca y con su siglo,16
heraldo_002372,heraldo,2372,feminismo,mujer moderna,Es deber de la mujer moderna ilustrarse y vivir con su época y con su siglo.,es deber de la mujer moderna ilustrarse y vivir con su epoca y con su siglo,16
heraldo_002379,heraldo,2379,mujer,femenino,Muchas CREMAS CUTANEAS debido á los ingredientes que entran en su elaboración HACEN SALIR VELLOS en el cutis los cuales como es muy sabido afean notablemente el rostro femenino.,muchas cremas cutaneas debido a los ingredientes que entran en su elaboracion hacen salir vellos en el cutis los cuales como es muy sabido afean notablemente el rostro femenino,29
heraldo_002382,heraldo,2382,mujer,mujer,Ayuntamiento de Madrid HERALDO DE LA MUJER.,ayuntamiento de madrid heraldo de la mujer,7
heraldo_002384,heraldo,2384,hogar,casa,"Lo que corresponda al primer tomo, será entregado al Instituto de Bienestar Social, para ayudar con algo a la implantación de la Casa Reformatoria de jóvenes desamparados.",lo que corresponda al primer tomo sera entregado al instituto de bienestar social para ayudar con algo a la implantacion de la casa reformatoria de jovenes desamparados,27
heraldo_002392,heraldo,2392,mujer,mujer,VIGI A laue el la y DIRECTORA ADMINISTRADORA ANA ROQUE DE DUPREY y los por su guinano pagonso y y y REVISTA MENSUAL DEFENSORA DE LOS DERECHOS DE LA MUJER Representante en Puerto Rico de la Alianza Internacional de Mujeres LEMAN LAS ARTOGRACIAS Y DENOGRACIAS.,vigi a laue el la y directora administradora ana roque de duprey y los por su guinano pagonso y y y revista mensual defensora de los derechos de la mujer representante en puerto rico de la alianza internacional de mujeres leman las artogracias y denogracias,45
heraldo_002392,heraldo,2392,mujer,mujeres,VIGI A laue el la y DIRECTORA ADMINISTRADORA ANA ROQUE DE DUPREY y los por su guinano pagonso y y y REVISTA MENSUAL DEFENSORA DE LOS DERECHOS DE LA MUJER Representante en Puerto Rico de la Alianza Internacional de Mujeres LEMAN LAS ARTOGRACIAS Y DENOGRACIAS.,vigi a laue el la y directora administradora ana roque de duprey y los por su guinano pagonso y y y revista mensual defensora de los derechos de la mujer representante en puerto rico de la alianza internacional de mujeres leman las artogracias y denogracias,45
heraldo_002392,heraldo,2392,feminismo,derechos de la mujer,VIGI A laue el la y DIRECTORA ADMINISTRADORA ANA ROQUE DE DUPREY y los por su guinano pagonso y y y REVISTA MENSUAL DEFENSORA DE LOS DERECHOS DE LA MUJER Representante en Puerto Rico de la Alianza Internacional de Mujeres LEMAN LAS ARTOGRACIAS Y DENOGRACIAS.,vigi a laue el la y directora administradora ana roque de duprey y los por su guinano pagonso y y y revista mensual defensora de los derechos de la mujer representante en puerto rico de la alianza internacional de mujeres leman las artogracias y denogracias,45
heraldo_002411,heraldo,2411,mujer,mujer,La Mujer y la civilización..........,la mujer y la civilizacion,5
heraldo_002414,heraldo,2414,educacion,escuela,Carmela Eulate La Escuela Correccional de Mayagiiez......,carmela eulate la escuela correccional de mayagiiez,7
heraldo_002423,heraldo,2423,mujer,mujer,"Y más aún tratándose de los de Puerto Rico, donde la cultura de la mujer corre parejas con su belleza y alta distinción — social.",y mas aun tratandose de los de puerto rico donde la cultura de la mujer corre parejas con su belleza y alta distincion social,24
heraldo_002423,heraldo,2423,educacion,cultura,"Y más aún tratándose de los de Puerto Rico, donde la cultura de la mujer corre parejas con su belleza y alta distinción — social.",y mas aun tratandose de los de puerto rico donde la cultura de la mujer corre parejas con su belleza y alta distincion social,24
heraldo_002424,heraldo,2424,feminismo,feminismo,"En los momentos actuales en que el feminismo va abriéndose paso con el fin de llegar al puesto que por derecho le — corresponde, ningún factor más importante, que una obra como el Diccionario Enciclopédico, que pueda servirla de portastandarte para con una preparación adecuada, obtener la consecución de sus ideales.",en los momentos actuales en que el feminismo va abriendose paso con el fin de llegar al puesto que por derecho le corresponde ningun factor mas importante que una obra como el diccionario enciclopedico que pueda servirla de portastandarte para con una preparacion adecuada obtener la consecucion de sus ideales,50
heraldo_002427,heraldo,2427,mujer,mujer,"Y allí encontrará también la mujer todas las afecciones de su alma, desde la religión hasta las ciencias, desde el teatro de los primeros tiempos hasta el de la época actual; la música en todos sus detalles, la literatura y bellas N artes. "" K Corte y Remita Hoy Mismo purante HOS meses.",y alli encontrara tambien la mujer todas las afecciones de su alma desde la religion hasta las ciencias desde el teatro de los primeros tiempos hasta el de la epoca actual la musica en todos sus detalles la literatura y bellas n artes k corte y remita hoy mismo purante hos meses,52
heraldo_002427,heraldo,2427,religion,religión,"Y allí encontrará también la mujer todas las afecciones de su alma, desde la religión hasta las ciencias, desde el teatro de los primeros tiempos hasta el de la época actual; la música en todos sus detalles, la literatura y bellas N artes. "" K Corte y Remita Hoy Mismo purante HOS meses.",y alli encontrara tambien la mujer todas las afecciones de su alma desde la religion hasta las ciencias desde el teatro de los primeros tiempos hasta el de la epoca actual la musica en todos sus detalles la literatura y bellas n artes k corte y remita hoy mismo purante hos meses,52
heraldo_002435,heraldo,2435,colonialismo,ocupación,Profesión u ocupación.....,profesion u ocupacion,3
heraldo_002436,heraldo,2436,mujer,mujer,"Calle y número Ayuntamiento de Madrid HERALDO DE LA MUJER. rrerrerrerrer N S a y — a de LA MUJER Y LA LIVILILACION a n Cada día trae su afán, Jeterio Cada época de la vida tiene sus necesidades y sus conveniencias mingún siglo se parece a otro, ni minguna dan otra la Las leves morales, escritas en la conciencia de los meblos y en los ciugos que los rigen van variando y humanizándose serán la mumanidad siene su progreso volutivo hacia su perfeccionamiento.",calle y numero ayuntamiento de madrid heraldo de la mujer rrerrerrerrer n s a y a de la mujer y la livililacion a n cada dia trae su afan jeterio cada epoca de la vida tiene sus necesidades y sus conveniencias mingun siglo se parece a otro ni minguna dan otra la las leves morales escritas en la conciencia de los meblos y en los ciugos que los rigen van variando y humanizandose seran la mumanidad siene su progreso volutivo hacia su perfeccionamiento,83
heraldo_002437,heraldo,2437,religion,moral,"Pero ninguna las moral puede ser usta, si en su pietien ocasiona perjuicio á un ser capaz de sentir el dolor fero o moral e actin en contra de las leves de la Naturaleza.",pero ninguna las moral puede ser usta si en su pietien ocasiona perjuicio a un ser capaz de sentir el dolor fero o moral e actin en contra de las leves de la naturaleza,34
heraldo_002438,heraldo,2438,religion,dios,"Por eso hemos visto á la Humanidad en los primeros tiempos de su historia, sacrincando hombres muje res y niños a la divinidad asurdo, que adoraba en su ignorancia, a la cual los precia en holocausto horrible con la esperanza de conseguir del dios monstroso que foriana inconcientemente en su tantesta, bienes torenos que halagasen sus pasiones, sin tener en cuenta el dolor cruento inicido otros seres. adelantando un tanto la humanidad por la vía promesita de la civilización desparecieron los acricios humanos mos subsisteron los de sangre entre los paganos de la riente y artistin rein y aún entre los hudigo renidos por Moisés que aún enciacaban animales.",por eso hemos visto a la humanidad en los primeros tiempos de su historia sacrincando hombres muje res y ninos a la divinidad asurdo que adoraba en su ignorancia a la cual los precia en holocausto horrible con la esperanza de conseguir del dios monstroso que foriana inconcientemente en su tantesta bienes torenos que halagasen sus pasiones sin tener en cuenta el dolor cruento inicido otros seres adelantando un tanto la humanidad por la via promesita de la civilizacion desparecieron los acricios humanos mos subsisteron los de sangre entre los paganos de la riente y artistin rein y aun entre los hudigo renidos por moises que aun enciacaban animales,109
heraldo_002440,heraldo,2440,religion,moral,"Tenemos leves para potener los animales y no las tenemos para pronibir que la humanidad e siga alimentanto de seres amados, que seguramente están posedos de un alma embrionaria y de igual fuera vital que nosotros y por lo tanto, sucentibles al dolor sico, y tal ves al dolor moral.",tenemos leves para potener los animales y no las tenemos para pronibir que la humanidad e siga alimentanto de seres amados que seguramente estan posedos de un alma embrionaria y de igual fuera vital que nosotros y por lo tanto sucentibles al dolor sico y tal ves al dolor moral,50
heraldo_002441,heraldo,2441,mujer,madre,Luego no es un sacrincio también el que una hija abandone a su madre y a su madre encianos y entemos quido para ingresar en una seta o congregación palsiosa privan de a los autores de sus alas de los aunios que reclama su vejer No es es contrario a la maturalera; Todavía le falta mucho a la Humanidad para alamar su perfeccionamiento para ser humana. y las muerros? Habrá cosa más hárbara que las guerras: Nada que la Humanidad no tiene aún ni la mitad de su camino andado.,luego no es un sacrincio tambien el que una hija abandone a su madre y a su madre encianos y entemos quido para ingresar en una seta o congregacion palsiosa privan de a los autores de sus alas de los aunios que reclama su vejer no es es contrario a la maturalera todavia le falta mucho a la humanidad para alamar su perfeccionamiento para ser humana y las muerros habra cosa mas harbara que las guerras nada que la humanidad no tiene aun ni la mitad de su camino andado,90
heraldo_002442,heraldo,2442,mujer,mujer,"En otro orden de cosas, estudiemos la mujer, de un modo ligro y superficial, como tiene que ser en un atículo de periódico, que lo principal que demando es onción.",en otro orden de cosas estudiemos la mujer de un modo ligro y superficial como tiene que ser en un aticulo de periodico que lo principal que demando es oncion,30
