sentence_id,documento,orden_frase,tema,keyword_detectada,frase_original,frase_normalizada,n_palabras
heraldo_000010,heraldo,10,mujer,mujer,HERALDO DE LA MUJER rrere Feres reFe FILIPINILA ANGELICINAS FARIS BAZAR.,heraldo de la mujer rrere feres refe filipinila angelicinas faris bazar,11
heraldo_000021,heraldo,21,mujer,mujer,Ayuntamiento de Madrid HERALDO DE LA MUJER QUULO JUU HIPIII.,ayuntamiento de madrid heraldo de la mujer quulo juu hipiii,10
heraldo_000033,heraldo,33,mujer,madre,En una las de un madre de umila puertorrieneno debe estar.,en una las de un madre de umila puertorrieneno debe estar,11
heraldo_000036,heraldo,36,mujer,damas,"Las damas que pierden el S cabello con frecuencia, y que quieran lucir una hermosa cabellera, y el que quiera combatir la calvicie, dirijase al señor A.",las damas que pierden el s cabello con frecuencia y que quieran lucir una hermosa cabellera y el que quiera combatir la calvicie dirijase al senor a,27
heraldo_000038,heraldo,38,patria,nacional,"ROQUE, hotel Nacional, San Juan, y los dejará complacidos.",roque hotel nacional san juan y los dejara complacidos,9
heraldo_000044,heraldo,44,mujer,mujer,"HERALDO DE LA MUJER Ayuntamiento de Madrid Hace el Hornear en Casa raciCon el auxilio de la ROYAL BARING POUDER se pueden hacer en casa pones y pacimente muras hermanos panecios pasata, el apreciosos y anos de tores que los que pueden comprane en las parecer.",heraldo de la mujer ayuntamiento de madrid hace el hornear en casa racicon el auxilio de la royal baring pouder se pueden hacer en casa pones y pacimente muras hermanos panecios pasata el apreciosos y anos de tores que los que pueden comprane en las parecer,46
heraldo_000044,heraldo,44,hogar,casa,"HERALDO DE LA MUJER Ayuntamiento de Madrid Hace el Hornear en Casa raciCon el auxilio de la ROYAL BARING POUDER se pueden hacer en casa pones y pacimente muras hermanos panecios pasata, el apreciosos y anos de tores que los que pueden comprane en las parecer.",heraldo de la mujer ayuntamiento de madrid hace el hornear en casa racicon el auxilio de la royal baring pouder se pueden hacer en casa pones y pacimente muras hermanos panecios pasata el apreciosos y anos de tores que los que pueden comprane en las parecer,46
heraldo_000049,heraldo,49,mujer,mujer,"N E HILIALDO DE LA MUEL ANTES ALBUM PUERTORRIQUENO Revista Quincenal Bilingue, Defensora de los Derechos de la Mujer DIRECTORA ADMINISTRADORA.—Ana Roqué de Duprey.",n e hilialdo de la muel antes album puertorriqueno revista quincenal bilingue defensora de los derechos de la mujer directora administradora ana roque de duprey,25
heraldo_000049,heraldo,49,feminismo,derechos de la mujer,"N E HILIALDO DE LA MUEL ANTES ALBUM PUERTORRIQUENO Revista Quincenal Bilingue, Defensora de los Derechos de la Mujer DIRECTORA ADMINISTRADORA.—Ana Roqué de Duprey.",n e hilialdo de la muel antes album puertorriqueno revista quincenal bilingue defensora de los derechos de la mujer directora administradora ana roque de duprey,25
heraldo_000072,heraldo,72,mujer,mujer,Davia oray AMONO WOMAN OS LATIN COUNTRIES.............................. y cerardine Mala roscher Representantes de Heraldo de la Mujer.............................,davia oray amono woman os latin countries y cerardine mala roscher representantes de heraldo de la mujer,17
heraldo_000076,heraldo,76,mujer,mujer,Ayuntamiento de Madrid HERALDO DE LA MUJER.,ayuntamiento de madrid heraldo de la mujer,7
heraldo_000078,heraldo,78,patria,independencia,"HaNUESTRO STATUS POLITICO F L Todo pueblo digno aspira á su independencia, eso es maudable.",hanuestro status politico f l todo pueblo digno aspira a su independencia eso es maudable,15
heraldo_000078,heraldo,78,patria,pueblo,"HaNUESTRO STATUS POLITICO F L Todo pueblo digno aspira á su independencia, eso es maudable.",hanuestro status politico f l todo pueblo digno aspira a su independencia eso es maudable,15
heraldo_000078,heraldo,78,colonialismo,independencia,"HaNUESTRO STATUS POLITICO F L Todo pueblo digno aspira á su independencia, eso es maudable.",hanuestro status politico f l todo pueblo digno aspira a su independencia eso es maudable,15
heraldo_000080,heraldo,80,mujer,mujeres,"Primeramente las palabras de la que presea porosas parte en derecho que tienen unos los pueblos de la era las prenta terminaciona Vicas, el misterar nuestra suncion económica. que esta bocada ponersamente de esas ma. buenaremos las espeindudablemente la guerra la presuerto el alga de los precios en los muretos de primera nuesiadpero la guerra ha terminado y el menos un han el pnero de peque las presiones que se maneparan por mar. actores que mar paratos puras las manos de empela despara Europa, pero empena punto en las una canas mujeres que de manera santenara los melas de los arrentos mas necesarios para la vida, empelamenteras.",primeramente las palabras de la que presea porosas parte en derecho que tienen unos los pueblos de la era las prenta terminaciona vicas el misterar nuestra suncion economica que esta bocada ponersamente de esas ma buenaremos las espeindudablemente la guerra la presuerto el alga de los precios en los muretos de primera nuesiadpero la guerra ha terminado y el menos un han el pnero de peque las presiones que se maneparan por mar actores que mar paratos puras las manos de empela despara europa pero empena punto en las una canas mujeres que de manera santenara los melas de los arrentos mas necesarios para la vida empelamenteras,107
heraldo_000081,heraldo,81,patria,pueblo,"Los Estados Unidos es un pueblo rico, y bien sabido es que mientras mas en es el pueblo, mas ento cuenta todo lo que el puePuerto Rico es un pueblo excesivamente pobre y tiene que pagar los los arrientos presivamente esos somos pures por rales de nuestas y purene era ser muapara en manos estanteras la mayor parte las que en tras pienes esencias en la cada de encar vener el para sas amanetas, sin estar enenen estra amar del encion asias estantes eneramente muerene que pagran en este muertorreno aque espiotan de en moso manado los mismo que es unacero que vue muren tambre y en me er miEs precios tener en cuenta que como la isla no pone los ensue tono de siene a importar el merciante necesionales de empen el persante puertorriqueno, ante la me por ese en queterna un relante es una ene nos herendo por eso en man en ambineamanes a esto que nuestras quenas estan recaradas a nuestos arrer muere los mas, es quienes hay que pasante encarnes susiade como el puere muy nera de verse asuncionEl puertorriqueño ros el hueso, con los suelos exignos.",los estados unidos es un pueblo rico y bien sabido es que mientras mas en es el pueblo mas ento cuenta todo lo que el puepuerto rico es un pueblo excesivamente pobre y tiene que pagar los los arrientos presivamente esos somos pures por rales de nuestas y purene era ser muapara en manos estanteras la mayor parte las que en tras pienes esencias en la cada de encar vener el para sas amanetas sin estar enenen estra amar del encion asias estantes eneramente muerene que pagran en este muertorreno aque espiotan de en moso manado los mismo que es unacero que vue muren tambre y en me er mies precios tener en cuenta que como la isla no pone los ensue tono de siene a importar el merciante necesionales de empen el persante puertorriqueno ante la me por ese en queterna un relante es una ene nos herendo por eso en man en ambineamanes a esto que nuestras quenas estan recaradas a nuestos arrer muere los mas es quienes hay que pasante encarnes susiade como el puere muy nera de verse asuncionel puertorriqueno ros el hueso con los suelos exignos,191
heraldo_000081,heraldo,81,colonialismo,estados unidos,"Los Estados Unidos es un pueblo rico, y bien sabido es que mientras mas en es el pueblo, mas ento cuenta todo lo que el puePuerto Rico es un pueblo excesivamente pobre y tiene que pagar los los arrientos presivamente esos somos pures por rales de nuestas y purene era ser muapara en manos estanteras la mayor parte las que en tras pienes esencias en la cada de encar vener el para sas amanetas, sin estar enenen estra amar del encion asias estantes eneramente muerene que pagran en este muertorreno aque espiotan de en moso manado los mismo que es unacero que vue muren tambre y en me er miEs precios tener en cuenta que como la isla no pone los ensue tono de siene a importar el merciante necesionales de empen el persante puertorriqueno, ante la me por ese en queterna un relante es una ene nos herendo por eso en man en ambineamanes a esto que nuestras quenas estan recaradas a nuestos arrer muere los mas, es quienes hay que pasante encarnes susiade como el puere muy nera de verse asuncionEl puertorriqueño ros el hueso, con los suelos exignos.",los estados unidos es un pueblo rico y bien sabido es que mientras mas en es el pueblo mas ento cuenta todo lo que el puepuerto rico es un pueblo excesivamente pobre y tiene que pagar los los arrientos presivamente esos somos pures por rales de nuestas y purene era ser muapara en manos estanteras la mayor parte las que en tras pienes esencias en la cada de encar vener el para sas amanetas sin estar enenen estra amar del encion asias estantes eneramente muerene que pagran en este muertorreno aque espiotan de en moso manado los mismo que es unacero que vue muren tambre y en me er mies precios tener en cuenta que como la isla no pone los ensue tono de siene a importar el merciante necesionales de empen el persante puertorriqueno ante la me por ese en queterna un relante es una ene nos herendo por eso en man en ambineamanes a esto que nuestras quenas estan recaradas a nuestos arrer muere los mas es quienes hay que pasante encarnes susiade como el puere muy nera de verse asuncionel puertorriqueno ros el hueso con los suelos exignos,191
heraldo_000082,heraldo,82,mujer,mujeres,"Estados que pasanos como mionarios sienas espuesto en panes puras y para mostener es gobierno lues enemos mujeres un sus cuanto namente y desuno, como los partas de la inlas pasolo engrante exaltado con precitas mal anas de espirabres que enen hace es gusto conde este en un en el purenes nerorqueno, que no tiene la cupa, y que se ve tamben por las mismas esAyuntamiento de Madrid A los Sres, epresentantes Americanos: sas, en el lecho de Procusto, y que bien podría de cile a ente pueblo puesto que lo increos, lo que muererana del e aninos enenos mernan cures los tan agan en unas para inAcaso estoy vo en un lecho de rosas? otra casa hay que pertura mucho a nuestra las: Estos los que tan terno las pronta de los Estados inlos han vinte que incistera de menin que las mercanlas en ameras pagaran sus derechos de aquena en las colorias los mue mupiera pereccion espor en en melaceres, las colores entan presamente que empre la madre para el peso que querian imponente las esporadores las merencias erraneras nos que mubiera poun compra mas paratas buenas retamente. una este mismo pas nos en pues los mien los proquctos erranterna venes de una por en empor de Emana, lo que la empranamos a la merepor los costena prepara.",estados que pasanos como mionarios sienas espuesto en panes puras y para mostener es gobierno lues enemos mujeres un sus cuanto namente y desuno como los partas de la inlas pasolo engrante exaltado con precitas mal anas de espirabres que enen hace es gusto conde este en un en el purenes nerorqueno que no tiene la cupa y que se ve tamben por las mismas esayuntamiento de madrid a los sres epresentantes americanos sas en el lecho de procusto y que bien podria de cile a ente pueblo puesto que lo increos lo que muererana del e aninos enenos mernan cures los tan agan en unas para inacaso estoy vo en un lecho de rosas otra casa hay que pertura mucho a nuestra las estos los que tan terno las pronta de los estados inlos han vinte que incistera de menin que las mercanlas en ameras pagaran sus derechos de aquena en las colorias los mue mupiera pereccion espor en en melaceres las colores entan presamente que empre la madre para el peso que querian imponente las esporadores las merencias erraneras nos que mubiera poun compra mas paratas buenas retamente una este mismo pas nos en pues los mien los proquctos erranterna venes de una por en empor de emana lo que la empranamos a la merepor los costena prepara,220
heraldo_000082,heraldo,82,mujer,madre,"Estados que pasanos como mionarios sienas espuesto en panes puras y para mostener es gobierno lues enemos mujeres un sus cuanto namente y desuno, como los partas de la inlas pasolo engrante exaltado con precitas mal anas de espirabres que enen hace es gusto conde este en un en el purenes nerorqueno, que no tiene la cupa, y que se ve tamben por las mismas esAyuntamiento de Madrid A los Sres, epresentantes Americanos: sas, en el lecho de Procusto, y que bien podría de cile a ente pueblo puesto que lo increos, lo que muererana del e aninos enenos mernan cures los tan agan en unas para inAcaso estoy vo en un lecho de rosas? otra casa hay que pertura mucho a nuestra las: Estos los que tan terno las pronta de los Estados inlos han vinte que incistera de menin que las mercanlas en ameras pagaran sus derechos de aquena en las colorias los mue mupiera pereccion espor en en melaceres, las colores entan presamente que empre la madre para el peso que querian imponente las esporadores las merencias erraneras nos que mubiera poun compra mas paratas buenas retamente. una este mismo pas nos en pues los mien los proquctos erranterna venes de una por en empor de Emana, lo que la empranamos a la merepor los costena prepara.",estados que pasanos como mionarios sienas espuesto en panes puras y para mostener es gobierno lues enemos mujeres un sus cuanto namente y desuno como los partas de la inlas pasolo engrante exaltado con precitas mal anas de espirabres que enen hace es gusto conde este en un en el purenes nerorqueno que no tiene la cupa y que se ve tamben por las mismas esayuntamiento de madrid a los sres epresentantes americanos sas en el lecho de procusto y que bien podria de cile a ente pueblo puesto que lo increos lo que muererana del e aninos enenos mernan cures los tan agan en unas para inacaso estoy vo en un lecho de rosas otra casa hay que pertura mucho a nuestra las estos los que tan terno las pronta de los estados inlos han vinte que incistera de menin que las mercanlas en ameras pagaran sus derechos de aquena en las colorias los mue mupiera pereccion espor en en melaceres las colores entan presamente que empre la madre para el peso que querian imponente las esporadores las merencias erraneras nos que mubiera poun compra mas paratas buenas retamente una este mismo pas nos en pues los mien los proquctos erranterna venes de una por en empor de emana lo que la empranamos a la merepor los costena prepara,220
heraldo_000082,heraldo,82,patria,pueblo,"Estados que pasanos como mionarios sienas espuesto en panes puras y para mostener es gobierno lues enemos mujeres un sus cuanto namente y desuno, como los partas de la inlas pasolo engrante exaltado con precitas mal anas de espirabres que enen hace es gusto conde este en un en el purenes nerorqueno, que no tiene la cupa, y que se ve tamben por las mismas esAyuntamiento de Madrid A los Sres, epresentantes Americanos: sas, en el lecho de Procusto, y que bien podría de cile a ente pueblo puesto que lo increos, lo que muererana del e aninos enenos mernan cures los tan agan en unas para inAcaso estoy vo en un lecho de rosas? otra casa hay que pertura mucho a nuestra las: Estos los que tan terno las pronta de los Estados inlos han vinte que incistera de menin que las mercanlas en ameras pagaran sus derechos de aquena en las colorias los mue mupiera pereccion espor en en melaceres, las colores entan presamente que empre la madre para el peso que querian imponente las esporadores las merencias erraneras nos que mubiera poun compra mas paratas buenas retamente. una este mismo pas nos en pues los mien los proquctos erranterna venes de una por en empor de Emana, lo que la empranamos a la merepor los costena prepara.",estados que pasanos como mionarios sienas espuesto en panes puras y para mostener es gobierno lues enemos mujeres un sus cuanto namente y desuno como los partas de la inlas pasolo engrante exaltado con precitas mal anas de espirabres que enen hace es gusto conde este en un en el purenes nerorqueno que no tiene la cupa y que se ve tamben por las mismas esayuntamiento de madrid a los sres epresentantes americanos sas en el lecho de procusto y que bien podria de cile a ente pueblo puesto que lo increos lo que muererana del e aninos enenos mernan cures los tan agan en unas para inacaso estoy vo en un lecho de rosas otra casa hay que pertura mucho a nuestra las estos los que tan terno las pronta de los estados inlos han vinte que incistera de menin que las mercanlas en ameras pagaran sus derechos de aquena en las colorias los mue mupiera pereccion espor en en melaceres las colores entan presamente que empre la madre para el peso que querian imponente las esporadores las merencias erraneras nos que mubiera poun compra mas paratas buenas retamente una este mismo pas nos en pues los mien los proquctos erranterna venes de una por en empor de emana lo que la empranamos a la merepor los costena prepara,220
heraldo_000082,heraldo,82,hogar,casa,"Estados que pasanos como mionarios sienas espuesto en panes puras y para mostener es gobierno lues enemos mujeres un sus cuanto namente y desuno, como los partas de la inlas pasolo engrante exaltado con precitas mal anas de espirabres que enen hace es gusto conde este en un en el purenes nerorqueno, que no tiene la cupa, y que se ve tamben por las mismas esAyuntamiento de Madrid A los Sres, epresentantes Americanos: sas, en el lecho de Procusto, y que bien podría de cile a ente pueblo puesto que lo increos, lo que muererana del e aninos enenos mernan cures los tan agan en unas para inAcaso estoy vo en un lecho de rosas? otra casa hay que pertura mucho a nuestra las: Estos los que tan terno las pronta de los Estados inlos han vinte que incistera de menin que las mercanlas en ameras pagaran sus derechos de aquena en las colorias los mue mupiera pereccion espor en en melaceres, las colores entan presamente que empre la madre para el peso que querian imponente las esporadores las merencias erraneras nos que mubiera poun compra mas paratas buenas retamente. una este mismo pas nos en pues los mien los proquctos erranterna venes de una por en empor de Emana, lo que la empranamos a la merepor los costena prepara.",estados que pasanos como mionarios sienas espuesto en panes puras y para mostener es gobierno lues enemos mujeres un sus cuanto namente y desuno como los partas de la inlas pasolo engrante exaltado con precitas mal anas de espirabres que enen hace es gusto conde este en un en el purenes nerorqueno que no tiene la cupa y que se ve tamben por las mismas esayuntamiento de madrid a los sres epresentantes americanos sas en el lecho de procusto y que bien podria de cile a ente pueblo puesto que lo increos lo que muererana del e aninos enenos mernan cures los tan agan en unas para inacaso estoy vo en un lecho de rosas otra casa hay que pertura mucho a nuestra las estos los que tan terno las pronta de los estados inlos han vinte que incistera de menin que las mercanlas en ameras pagaran sus derechos de aquena en las colorias los mue mupiera pereccion espor en en melaceres las colores entan presamente que empre la madre para el peso que querian imponente las esporadores las merencias erraneras nos que mubiera poun compra mas paratas buenas retamente una este mismo pas nos en pues los mien los proquctos erranterna venes de una por en empor de emana lo que la empranamos a la merepor los costena prepara,220
heraldo_000089,heraldo,89,mujer,mujeres,"Y las tropas puertorriqueñas, mantenidas por el gopero amenemos sentan propas resultantes del gran ejercio de la Nación mas grande de la tierra, a las que cada puerte. estan venertoriquena puras amor y alenidad. raternos des amor de la atención de esguiernos que puras ser estantemeninos un en ene la Nacios americana nos una nuestra interesencia con a presionado mentante que tener este la peamos. creemos interpretar el pensar de la mayoria de las Mujeres puertorriquenas.",y las tropas puertorriquenas mantenidas por el gopero amenemos sentan propas resultantes del gran ejercio de la nacion mas grande de la tierra a las que cada puerte estan venertoriquena puras amor y alenidad raternos des amor de la atencion de esguiernos que puras ser estantemeninos un en ene la nacios americana nos una nuestra interesencia con a presionado mentante que tener este la peamos creemos interpretar el pensar de la mayoria de las mujeres puertorriquenas,76
heraldo_000089,heraldo,89,patria,nación,"Y las tropas puertorriqueñas, mantenidas por el gopero amenemos sentan propas resultantes del gran ejercio de la Nación mas grande de la tierra, a las que cada puerte. estan venertoriquena puras amor y alenidad. raternos des amor de la atención de esguiernos que puras ser estantemeninos un en ene la Nacios americana nos una nuestra interesencia con a presionado mentante que tener este la peamos. creemos interpretar el pensar de la mayoria de las Mujeres puertorriquenas.",y las tropas puertorriquenas mantenidas por el gopero amenemos sentan propas resultantes del gran ejercio de la nacion mas grande de la tierra a las que cada puerte estan venertoriquena puras amor y alenidad raternos des amor de la atencion de esguiernos que puras ser estantemeninos un en ene la nacios americana nos una nuestra interesencia con a presionado mentante que tener este la peamos creemos interpretar el pensar de la mayoria de las mujeres puertorriquenas,76
heraldo_000091,heraldo,91,mujer,mujer,"HERALDO DE LA MUJER CREPRESENIANTES DE HERALDO DE LA MUJER En vista del favor que vienen dispensando a nuestra Revista Femenina, tanto las más distinguidas Señoras, como los Caballeros más cultos, hemos decidido nombrar una señora o señorita, entre las más prestigiosas de cada población de Puerto Rico, como Representante de HERALDO DE LA MUJERN, que es el PORTAESTANDARTE DE LA CULTURA FEMENINA.",heraldo de la mujer crepreseniantes de heraldo de la mujer en vista del favor que vienen dispensando a nuestra revista femenina tanto las mas distinguidas senoras como los caballeros mas cultos hemos decidido nombrar una senora o senorita entre las mas prestigiosas de cada poblacion de puerto rico como representante de heraldo de la mujern que es el portaestandarte de la cultura femenina,63
heraldo_000091,heraldo,91,mujer,femenina,"HERALDO DE LA MUJER CREPRESENIANTES DE HERALDO DE LA MUJER En vista del favor que vienen dispensando a nuestra Revista Femenina, tanto las más distinguidas Señoras, como los Caballeros más cultos, hemos decidido nombrar una señora o señorita, entre las más prestigiosas de cada población de Puerto Rico, como Representante de HERALDO DE LA MUJERN, que es el PORTAESTANDARTE DE LA CULTURA FEMENINA.",heraldo de la mujer crepreseniantes de heraldo de la mujer en vista del favor que vienen dispensando a nuestra revista femenina tanto las mas distinguidas senoras como los caballeros mas cultos hemos decidido nombrar una senora o senorita entre las mas prestigiosas de cada poblacion de puerto rico como representante de heraldo de la mujern que es el portaestandarte de la cultura femenina,63
heraldo_000091,heraldo,91,mujer,señorita,"HERALDO DE LA MUJER CREPRESENIANTES DE HERALDO DE LA MUJER En vista del favor que vienen dispensando a nuestra Revista Femenina, tanto las más distinguidas Señoras, como los Caballeros más cultos, hemos decidido nombrar una señora o señorita, entre las más prestigiosas de cada población de Puerto Rico, como Representante de HERALDO DE LA MUJERN, que es el PORTAESTANDARTE DE LA CULTURA FEMENINA.",heraldo de la mujer crepreseniantes de heraldo de la mujer en vista del favor que vienen dispensando a nuestra revista femenina tanto las mas distinguidas senoras como los caballeros mas cultos hemos decidido nombrar una senora o senorita entre las mas prestigiosas de cada poblacion de puerto rico como representante de heraldo de la mujern que es el portaestandarte de la cultura femenina,63
heraldo_000091,heraldo,91,educacion,cultura,"HERALDO DE LA MUJER CREPRESENIANTES DE HERALDO DE LA MUJER En vista del favor que vienen dispensando a nuestra Revista Femenina, tanto las más distinguidas Señoras, como los Caballeros más cultos, hemos decidido nombrar una señora o señorita, entre las más prestigiosas de cada población de Puerto Rico, como Representante de HERALDO DE LA MUJERN, que es el PORTAESTANDARTE DE LA CULTURA FEMENINA.",heraldo de la mujer crepreseniantes de heraldo de la mujer en vista del favor que vienen dispensando a nuestra revista femenina tanto las mas distinguidas senoras como los caballeros mas cultos hemos decidido nombrar una senora o senorita entre las mas prestigiosas de cada poblacion de puerto rico como representante de heraldo de la mujern que es el portaestandarte de la cultura femenina,63
heraldo_000092,heraldo,92,mujer,mujer,No exigimos a nuestra representante que sea precisamente una feminista convencida basta que sea una mujer progresista y que se interese por la cultura de las puertorriqueñas.,no exigimos a nuestra representante que sea precisamente una feminista convencida basta que sea una mujer progresista y que se interese por la cultura de las puertorriquenas,27
heraldo_000092,heraldo,92,feminismo,feminista,No exigimos a nuestra representante que sea precisamente una feminista convencida basta que sea una mujer progresista y que se interese por la cultura de las puertorriqueñas.,no exigimos a nuestra representante que sea precisamente una feminista convencida basta que sea una mujer progresista y que se interese por la cultura de las puertorriquenas,27
