sentence_id,documento,orden_frase,tema,keyword_detectada,frase_original,frase_normalizada,n_palabras
filipinas_001523,filipinas,1523,hogar,hijos,"¡Cuánta verdad encierra aquel decir que ""la fuerza de la muger está en su mismadebilidad.” Algunos esposos dignos y honrados que aman verdaderamente á sus esposas, les conceden los derechos que la asisten como su compañera compartiendo con ella sus alegrias, sus penas y trabajos, endulzando las amarguras de la vida con asiduidad y cariño, asistiendola solícito en sus enfermedades y privandose las más de las veces de todo lo mas necesario para cubrir las necesidades de su esposa é hijos, Sería largo enumerar los netos heróicos llevados á cabo nor hombres que son el contraste de otros infames é ingratos que por satisfafacer sus malhadados vicios y brutales pasiones, reducen á la más espantosa miseria á su esposa é hijos, degradando á aquella, envillociendose él, siendo objetos de comentarios porparte de la sociedad y de toda gente sensata.",cuanta verdad encierra aquel decir que la fuerza de la muger esta en su mismadebilidad algunos esposos dignos y honrados que aman verdaderamente a sus esposas les conceden los derechos que la asisten como su companera compartiendo con ella sus alegrias sus penas y trabajos endulzando las amarguras de la vida con asiduidad y carino asistiendola solicito en sus enfermedades y privandose las mas de las veces de todo lo mas necesario para cubrir las necesidades de su esposa e hijos seria largo enumerar los netos heroicos llevados a cabo nor hombres que son el contraste de otros infames e ingratos que por satisfafacer sus malhadados vicios y brutales pasiones reducen a la mas espantosa miseria a su esposa e hijos degradando a aquella envillociendose el siendo objetos de comentarios porparte de la sociedad y de toda gente sensata,139
filipinas_001523,filipinas,1523,hogar,esposa,"¡Cuánta verdad encierra aquel decir que ""la fuerza de la muger está en su mismadebilidad.” Algunos esposos dignos y honrados que aman verdaderamente á sus esposas, les conceden los derechos que la asisten como su compañera compartiendo con ella sus alegrias, sus penas y trabajos, endulzando las amarguras de la vida con asiduidad y cariño, asistiendola solícito en sus enfermedades y privandose las más de las veces de todo lo mas necesario para cubrir las necesidades de su esposa é hijos, Sería largo enumerar los netos heróicos llevados á cabo nor hombres que son el contraste de otros infames é ingratos que por satisfafacer sus malhadados vicios y brutales pasiones, reducen á la más espantosa miseria á su esposa é hijos, degradando á aquella, envillociendose él, siendo objetos de comentarios porparte de la sociedad y de toda gente sensata.",cuanta verdad encierra aquel decir que la fuerza de la muger esta en su mismadebilidad algunos esposos dignos y honrados que aman verdaderamente a sus esposas les conceden los derechos que la asisten como su companera compartiendo con ella sus alegrias sus penas y trabajos endulzando las amarguras de la vida con asiduidad y carino asistiendola solicito en sus enfermedades y privandose las mas de las veces de todo lo mas necesario para cubrir las necesidades de su esposa e hijos seria largo enumerar los netos heroicos llevados a cabo nor hombres que son el contraste de otros infames e ingratos que por satisfafacer sus malhadados vicios y brutales pasiones reducen a la mas espantosa miseria a su esposa e hijos degradando a aquella envillociendose el siendo objetos de comentarios porparte de la sociedad y de toda gente sensata,139
filipinas_001524,filipinas,1524,mujer,mujer,"Ademas, aprovechan de la debilidad de la mujer para cometer con ella toda clase de ignominias, quitandolas los derechos que la naturaleza les concedió, tratándolas como esclavas y no como esposas y compañeras, La mayor parte de los hombres creen además, que la mujer una vez casada, la obligación de esta se reduce á servir al esposo atender exclusivamente los quehaceres domesticos prohibiendola toda diverción y trato de gentes, haciendola estunida é intratable De allí viene también que algunas, tras de no haber recibido una esperada educción en su infancia y no llevan en su alma bien cimentado la resignación santa y divina fruto Recetas Culinarias Huevos a la nieve.",ademas aprovechan de la debilidad de la mujer para cometer con ella toda clase de ignominias quitandolas los derechos que la naturaleza les concedio tratandolas como esclavas y no como esposas y companeras la mayor parte de los hombres creen ademas que la mujer una vez casada la obligacion de esta se reduce a servir al esposo atender exclusivamente los quehaceres domesticos prohibiendola toda divercion y trato de gentes haciendola estunida e intratable de alli viene tambien que algunas tras de no haber recibido una esperada educcion en su infancia y no llevan en su alma bien cimentado la resignacion santa y divina fruto recetas culinarias huevos a la nieve,110
filipinas_001524,filipinas,1524,hogar,esposo,"Ademas, aprovechan de la debilidad de la mujer para cometer con ella toda clase de ignominias, quitandolas los derechos que la naturaleza les concedió, tratándolas como esclavas y no como esposas y compañeras, La mayor parte de los hombres creen además, que la mujer una vez casada, la obligación de esta se reduce á servir al esposo atender exclusivamente los quehaceres domesticos prohibiendola toda diverción y trato de gentes, haciendola estunida é intratable De allí viene también que algunas, tras de no haber recibido una esperada educción en su infancia y no llevan en su alma bien cimentado la resignación santa y divina fruto Recetas Culinarias Huevos a la nieve.",ademas aprovechan de la debilidad de la mujer para cometer con ella toda clase de ignominias quitandolas los derechos que la naturaleza les concedio tratandolas como esclavas y no como esposas y companeras la mayor parte de los hombres creen ademas que la mujer una vez casada la obligacion de esta se reduce a servir al esposo atender exclusivamente los quehaceres domesticos prohibiendola toda divercion y trato de gentes haciendola estunida e intratable de alli viene tambien que algunas tras de no haber recibido una esperada educcion en su infancia y no llevan en su alma bien cimentado la resignacion santa y divina fruto recetas culinarias huevos a la nieve,110
filipinas_001530,filipinas,1530,raza,negra,"Después de quitarlo la aleta del medio de la cola á fin de extraer al mismo. tiempo una trina negra y amarga, hágansa cocer en el caldo, y después de diez minutos retírese la cacerola, que debe tenerse tapada, y en la cual deben dejarse los cangrejos todavía una media hora.",despues de quitarlo la aleta del medio de la cola a fin de extraer al mismo tiempo una trina negra y amarga hagansa cocer en el caldo y despues de diez minutos retirese la cacerola que debe tenerse tapada y en la cual deben dejarse los cangrejos todavia una media hora,51
filipinas_001533,filipinas,1533,raza,blanca,Ponganse á un fuego moderado y añadanse un ramito de perejil y alguna cebolla blanca.,ponganse a un fuego moderado y anadanse un ramito de perejil y alguna cebolla blanca,15
filipinas_001535,filipinas,1535,patria,nación,"El perejil se quita antes de servirlos. de la religión, en donde esposas cristianas encuentran un linitivo en todas sus pesares y disgustos, elevando sus plegarias á Aquel que es la fortaleza y apoyo de los degraciados: aquellas, pues, que ignoran lo que es la resiga nación y se encuentran desgraciadas en su hogar olvidan sus deberes, su decoro y renutación, buscan dicha y bienestar en otro hogar manchando, envileciendo el nombre del hombre que no supo respetarla ni supo darla sus derechos.",el perejil se quita antes de servirlos de la religion en donde esposas cristianas encuentran un linitivo en todas sus pesares y disgustos elevando sus plegarias a aquel que es la fortaleza y apoyo de los degraciados aquellas pues que ignoran lo que es la resiga nacion y se encuentran desgraciadas en su hogar olvidan sus deberes su decoro y renutacion buscan dicha y bienestar en otro hogar manchando envileciendo el nombre del hombre que no supo respetarla ni supo darla sus derechos,83
filipinas_001535,filipinas,1535,hogar,hogar,"El perejil se quita antes de servirlos. de la religión, en donde esposas cristianas encuentran un linitivo en todas sus pesares y disgustos, elevando sus plegarias á Aquel que es la fortaleza y apoyo de los degraciados: aquellas, pues, que ignoran lo que es la resiga nación y se encuentran desgraciadas en su hogar olvidan sus deberes, su decoro y renutación, buscan dicha y bienestar en otro hogar manchando, envileciendo el nombre del hombre que no supo respetarla ni supo darla sus derechos.",el perejil se quita antes de servirlos de la religion en donde esposas cristianas encuentran un linitivo en todas sus pesares y disgustos elevando sus plegarias a aquel que es la fortaleza y apoyo de los degraciados aquellas pues que ignoran lo que es la resiga nacion y se encuentran desgraciadas en su hogar olvidan sus deberes su decoro y renutacion buscan dicha y bienestar en otro hogar manchando envileciendo el nombre del hombre que no supo respetarla ni supo darla sus derechos,83
filipinas_001535,filipinas,1535,religion,religión,"El perejil se quita antes de servirlos. de la religión, en donde esposas cristianas encuentran un linitivo en todas sus pesares y disgustos, elevando sus plegarias á Aquel que es la fortaleza y apoyo de los degraciados: aquellas, pues, que ignoran lo que es la resiga nación y se encuentran desgraciadas en su hogar olvidan sus deberes, su decoro y renutación, buscan dicha y bienestar en otro hogar manchando, envileciendo el nombre del hombre que no supo respetarla ni supo darla sus derechos.",el perejil se quita antes de servirlos de la religion en donde esposas cristianas encuentran un linitivo en todas sus pesares y disgustos elevando sus plegarias a aquel que es la fortaleza y apoyo de los degraciados aquellas pues que ignoran lo que es la resiga nacion y se encuentran desgraciadas en su hogar olvidan sus deberes su decoro y renutacion buscan dicha y bienestar en otro hogar manchando envileciendo el nombre del hombre que no supo respetarla ni supo darla sus derechos,83
filipinas_001536,filipinas,1536,mujer,mujer,"As pues, repetirá aquí un cuarteto de los versos de la poetisa Juana de la Cruz, que dica: ¡""Hombres necios que culpaís. á la mujer sin razón, sin ver que sos la ocación de la misma que juzgais!"" Cebú, 23 Dic., 1909. de la misma que juzgais!"" BENITA A.",as pues repetira aqui un cuarteto de los versos de la poetisa juana de la cruz que dica hombres necios que culpais a la mujer sin razon sin ver que sos la ocacion de la misma que juzgais cebu 23 dic 1909 de la misma que juzgais benita a,49
filipinas_001539,filipinas,1539,mujer,mujer,"IMPERIAL LIVERY STABLE LOS MEJORES VEHICULOS QUE HAY EN EL EXTREMO ORIENTE Cervantes no 390.—Teléfono I. 312 ""FILIPINAS"" a HERMOSURA E HIGIENE ada de FILATOS E LA BELLEZA DE LAS MANOS Las manos deben ser objeto de particular atención tanto del hombre como de la mujer Son un exnonente vivo y constante de la cultura, nficiones y hasta del carácter de la persona.",imperial livery stable los mejores vehiculos que hay en el extremo oriente cervantes no 390 telefono i 312 filipinas a hermosura e higiene ada de filatos e la belleza de las manos las manos deben ser objeto de particular atencion tanto del hombre como de la mujer son un exnonente vivo y constante de la cultura nficiones y hasta del caracter de la persona,64
filipinas_001539,filipinas,1539,educacion,cultura,"IMPERIAL LIVERY STABLE LOS MEJORES VEHICULOS QUE HAY EN EL EXTREMO ORIENTE Cervantes no 390.—Teléfono I. 312 ""FILIPINAS"" a HERMOSURA E HIGIENE ada de FILATOS E LA BELLEZA DE LAS MANOS Las manos deben ser objeto de particular atención tanto del hombre como de la mujer Son un exnonente vivo y constante de la cultura, nficiones y hasta del carácter de la persona.",imperial livery stable los mejores vehiculos que hay en el extremo oriente cervantes no 390 telefono i 312 filipinas a hermosura e higiene ada de filatos e la belleza de las manos las manos deben ser objeto de particular atencion tanto del hombre como de la mujer son un exnonente vivo y constante de la cultura nficiones y hasta del caracter de la persona,64
filipinas_001544,filipinas,1544,raza,blanca,"Tenemos la mano largs, fina y flexible del pianista, Como tipo de mano de pintor encontramos una, blanca y grande: si como otra ancha, fuerte y terminada en dedos gruesos y cortos nos dá idea del hombre de trabajo.",tenemos la mano largs fina y flexible del pianista como tipo de mano de pintor encontramos una blanca y grande si como otra ancha fuerte y terminada en dedos gruesos y cortos nos da idea del hombre de trabajo,39
filipinas_001553,filipinas,1553,educacion,escuela,"En cambio qué suma de gracia y de belleza se adquiere por un cuidado constantel Sen infinitos los recursos para lograr la distinción apetecida, Y no nos referimos á práticas de alta escuela fnera del alcanca de la mayoría.",en cambio que suma de gracia y de belleza se adquiere por un cuidado constantel sen infinitos los recursos para lograr la distincion apetecida y no nos referimos a praticas de alta escuela fnera del alcanca de la mayoria,39
filipinas_001586,filipinas,1586,hogar,casa,"Quiroga acaba de firmar un contrato con una importantísima casa comercial de Jaya para exportar á dicha Isla 400 magníficas camas de hierro y bronce todas MODELO QUIROGA único que en estas Islas se fabrica porobreros filipinos y que puede competir con la manufactura Europea. brada, emocionada; pero los señores que alumbraban en la procesión, indignados de la parodin.",quiroga acaba de firmar un contrato con una importantisima casa comercial de jaya para exportar a dicha isla 400 magnificas camas de hierro y bronce todas modelo quiroga unico que en estas islas se fabrica porobreros filipinos y que puede competir con la manufactura europea brada emocionada pero los senores que alumbraban en la procesion indignados de la parodin,59
filipinas_001588,filipinas,1588,patria,pueblo,"Asegura que él bajó al pueblo para que la gente se acordase del Padre y del Hijo, á quienes tenemos, según dice, completamente olvidados.",asegura que el bajo al pueblo para que la gente se acordase del padre y del hijo a quienes tenemos segun dice completamente olvidados,24
filipinas_001592,filipinas,1592,mujer,damas,"Diligentes damas, ¿quereis. saber lo que hace falta en vuestra casapara que reine siempre la alegria? Comprad un JAMON PINA de los que vende Vicente E.",diligentes damas quereis saber lo que hace falta en vuestra casapara que reine siempre la alegria comprad un jamon pina de los que vende vicente e,26
filipinas_001598,filipinas,1598,mujer,mujer,FILIPINAS REVISTA SEMANAL ILUSTRADA POR Y PARA LA MUJER Nuestras Hermosas SRTA.,filipinas revista semanal ilustrada por y para la mujer nuestras hermosas srta,12
filipinas_001604,filipinas,1604,hogar,casa,"FOTOGRAFIA LA MAS ARTISTICA EN EL ORIENTE, PEINADORA GRATIS TODOS LOS DIAS Se hacen regalos a proposito INTERNATIONAL STUDIO 39.—ESCOLTA, MANILA NENENG RIZAL ALTOS DE LA CASA-N.o 182, C LLE LACOSTE, STA.",fotografia la mas artistica en el oriente peinadora gratis todos los dias se hacen regalos a proposito international studio 39 escolta manila neneng rizal altos de la casa n o 182 c lle lacoste sta,35
filipinas_001608,filipinas,1608,mujer,mujer,"SEMANARIO ""FILIPINAS” POR Y PARA LA MUJER NUESTRAS ILUSTRADAS SRTA.",semanario filipinas por y para la mujer nuestras ilustradas srta,10
filipinas_001609,filipinas,1609,educacion,inteligencia,"ELPIDIA YÍA Esta jóven es una de las filipinas más encantadoras, inteligencia clarísima, corazón de angel, hermosa como hay pocas.",elpidia yia esta joven es una de las filipinas mas encantadoras inteligencia clarisima corazon de angel hermosa como hay pocas,20
filipinas_001610,filipinas,1610,mujer,mujeres,"Desde muy niña cursó la primera enseñanza en la escuela pública de su pueblo natal, Pagsanghan, Laguna, continuó después sus estudios en el Instituto de Mujeres de esta ciudad, donde obtuvo las más brillantes calificaciones.",desde muy nina curso la primera ensenanza en la escuela publica de su pueblo natal pagsanghan laguna continuo despues sus estudios en el instituto de mujeres de esta ciudad donde obtuvo las mas brillantes calificaciones,35
filipinas_001610,filipinas,1610,patria,pueblo,"Desde muy niña cursó la primera enseñanza en la escuela pública de su pueblo natal, Pagsanghan, Laguna, continuó después sus estudios en el Instituto de Mujeres de esta ciudad, donde obtuvo las más brillantes calificaciones.",desde muy nina curso la primera ensenanza en la escuela publica de su pueblo natal pagsanghan laguna continuo despues sus estudios en el instituto de mujeres de esta ciudad donde obtuvo las mas brillantes calificaciones,35
filipinas_001610,filipinas,1610,educacion,enseñanza,"Desde muy niña cursó la primera enseñanza en la escuela pública de su pueblo natal, Pagsanghan, Laguna, continuó después sus estudios en el Instituto de Mujeres de esta ciudad, donde obtuvo las más brillantes calificaciones.",desde muy nina curso la primera ensenanza en la escuela publica de su pueblo natal pagsanghan laguna continuo despues sus estudios en el instituto de mujeres de esta ciudad donde obtuvo las mas brillantes calificaciones,35
filipinas_001610,filipinas,1610,educacion,escuela,"Desde muy niña cursó la primera enseñanza en la escuela pública de su pueblo natal, Pagsanghan, Laguna, continuó después sus estudios en el Instituto de Mujeres de esta ciudad, donde obtuvo las más brillantes calificaciones.",desde muy nina curso la primera ensenanza en la escuela publica de su pueblo natal pagsanghan laguna continuo despues sus estudios en el instituto de mujeres de esta ciudad donde obtuvo las mas brillantes calificaciones,35
filipinas_001611,filipinas,1611,educacion,educación,"Terminada su educación en castellano, indujéronla sus nobles ambiciones al estudio del inglés y sucesivamente cursó y aprobó los estudios oficiales en las escuelas primaria, intermedia y superior de la Laguna, ingresando después en la superior de Manila, en la cual acaba de licenciarse.",terminada su educacion en castellano indujeronla sus nobles ambiciones al estudio del ingles y sucesivamente curso y aprobo los estudios oficiales en las escuelas primaria intermedia y superior de la laguna ingresando despues en la superior de manila en la cual acaba de licenciarse,44
filipinas_001612,filipinas,1612,colonialismo,estados unidos,"Hace cuatro años tomó parte en las oposiciones oficiales para cubrir las plazas de alumnos pensionados en los Estados Unidos, y con brillante promedio de 94,62 conquistó el cuarto puesto de la lista entre los 47 opositores que fueron aprobados.",hace cuatro anos tomo parte en las oposiciones oficiales para cubrir las plazas de alumnos pensionados en los estados unidos y con brillante promedio de 94 62 conquisto el cuarto puesto de la lista entre los 47 opositores que fueron aprobados,41
filipinas_001618,filipinas,1618,patria,pueblo,"Su cráter se halla en los 1279 20'10"" de longitud del meridiano de Madrid- y 1300 14'10” de latitud N., al O. del pueblo de Libog y al NO. del de Albay.",su crater se halla en los 1279 20 10 de longitud del meridiano de madrid y 1300 14 10 de latitud n al o del pueblo de libog y al no del de albay,34
filipinas_001627,filipinas,1627,patria,pueblo,"En Junio de 1766 arrojó cenizas, arenas y grandes piedras, sintiéndose repetidos temblores.—El 23 de Octubre de 1767 tuvo lugar una muy terrible, que destruyó totalmente el pueblo de Malinaw y ocasionó grandes daños á los de Cagsawa, Camalig, Budyaw, Guinobatan, Polangui y Ligaw.",en junio de 1766 arrojo cenizas arenas y grandes piedras sintiendose repetidos temblores el 23 de octubre de 1767 tuvo lugar una muy terrible que destruyo totalmente el pueblo de malinaw y ocasiono grandes danos a los de cagsawa camalig budyaw guinobatan polangui y ligaw,45
filipinas_001635,filipinas,1635,mujer,mujer,"Posteriormente han ocurrido varias erupciones, y aun ahora continua despidiendo espesas nubes de humo y rojizos resplandores que lo revisten de imponente aspecto y majestuosa esbeltez. 11 SEMANARIO ""FILIPINAS"" POR Y PARA MUJER NUESTRAS HERMOSAS SRTA.",posteriormente han ocurrido varias erupciones y aun ahora continua despidiendo espesas nubes de humo y rojizos resplandores que lo revisten de imponente aspecto y majestuosa esbeltez 11 semanario filipinas por y para mujer nuestras hermosas srta,36
filipinas_001637,filipinas,1637,educacion,inteligencia,"FELICIDAD VILLARICA, es jóven bellísima, rica de inteligencia, de virtudes y de encantos, de tal modo que su apellido sujestivo queda en ella bastantemente justificado.",felicidad villarica es joven bellisima rica de inteligencia de virtudes y de encantos de tal modo que su apellido sujestivo queda en ella bastantemente justificado,25
filipinas_001642,filipinas,1642,mujer,madre,"Rizal escribe lo siguiente: “Dapitan, 15 de Enero de 1596. “Mi muy querida madre: Recibirán ustedes un poco de pescado salado que ha sa¬ ""lado la persona que vive en mi casa.",rizal escribe lo siguiente dapitan 15 de enero de 1596 mi muy querida madre recibiran ustedes un poco de pescado salado que ha sa lado la persona que vive en mi casa,32
filipinas_001642,filipinas,1642,hogar,casa,"Rizal escribe lo siguiente: “Dapitan, 15 de Enero de 1596. “Mi muy querida madre: Recibirán ustedes un poco de pescado salado que ha sa¬ ""lado la persona que vive en mi casa.",rizal escribe lo siguiente dapitan 15 de enero de 1596 mi muy querida madre recibiran ustedes un poco de pescado salado que ha sa lado la persona que vive en mi casa,32
filipinas_001645,filipinas,1645,religion,dios,EN GRACIA DE DIOS QUE CASADO EN PECADO MORTAL.,en gracia de dios que casado en pecado mortal,9
filipinas_001648,filipinas,1648,mujer,mujer,"Además, no tiene à nadie en el mundo más que á mí. ""Su afmo. hijo que le quiere, JOSE RIZAL.” FILIPINAS SEMANARIO ILUSTRADO DE CIENCIAS, LITERATURA, BELLAS ARTES, MEDICINAS CASERAS, HIGIENE Y CONOCIMIENTOS ÚTILES EN LA VIDA PRÁCTICA. —Dedicado exclusivamente a la mujer La mujer sabia edifica de la nada su casa; mas la mujer insensata lejos deedificar una casa que no existe, destruve con sus manos la que existe ya. (Prov.",ademas no tiene a nadie en el mundo mas que a mi su afmo hijo que le quiere jose rizal filipinas semanario ilustrado de ciencias literatura bellas artes medicinas caseras higiene y conocimientos utiles en la vida practica dedicado exclusivamente a la mujer la mujer sabia edifica de la nada su casa mas la mujer insensata lejos deedificar una casa que no existe destruve con sus manos la que existe ya prov,72
filipinas_001648,filipinas,1648,hogar,casa,"Además, no tiene à nadie en el mundo más que á mí. ""Su afmo. hijo que le quiere, JOSE RIZAL.” FILIPINAS SEMANARIO ILUSTRADO DE CIENCIAS, LITERATURA, BELLAS ARTES, MEDICINAS CASERAS, HIGIENE Y CONOCIMIENTOS ÚTILES EN LA VIDA PRÁCTICA. —Dedicado exclusivamente a la mujer La mujer sabia edifica de la nada su casa; mas la mujer insensata lejos deedificar una casa que no existe, destruve con sus manos la que existe ya. (Prov.",ademas no tiene a nadie en el mundo mas que a mi su afmo hijo que le quiere jose rizal filipinas semanario ilustrado de ciencias literatura bellas artes medicinas caseras higiene y conocimientos utiles en la vida practica dedicado exclusivamente a la mujer la mujer sabia edifica de la nada su casa mas la mujer insensata lejos deedificar una casa que no existe destruve con sus manos la que existe ya prov,72
filipinas_001656,filipinas,1656,mujer,mujer,Andrés Bonifacio Y LA MUJER FILIPINA El día 25 de este més nuestros compatriotas celebrarán una gran fiesta en honor de uno de nuestros más grandes y preclaros héroes: Andrés Bonifacio.,andres bonifacio y la mujer filipina el dia 25 de este mes nuestros compatriotas celebraran una gran fiesta en honor de uno de nuestros mas grandes y preclaros heroes andres bonifacio,31
filipinas_001657,filipinas,1657,patria,pueblo,"El pueblo filpino demostrará en ese día indecible regocijo por el amor intenso que siente hácia aquél que ha tenido un corazón que ha sabido dispertar las energías latentes, las virtudes adormecidas de una raza antes envilecida, hoy fuerte y vigorosa.",el pueblo filpino demostrara en ese dia indecible regocijo por el amor intenso que siente hacia aquel que ha tenido un corazon que ha sabido dispertar las energias latentes las virtudes adormecidas de una raza antes envilecida hoy fuerte y vigorosa,41
filipinas_001657,filipinas,1657,raza,raza,"El pueblo filpino demostrará en ese día indecible regocijo por el amor intenso que siente hácia aquél que ha tenido un corazón que ha sabido dispertar las energías latentes, las virtudes adormecidas de una raza antes envilecida, hoy fuerte y vigorosa.",el pueblo filpino demostrara en ese dia indecible regocijo por el amor intenso que siente hacia aquel que ha tenido un corazon que ha sabido dispertar las energias latentes las virtudes adormecidas de una raza antes envilecida hoy fuerte y vigorosa,41
