sentence_id,documento,orden_frase,tema,keyword_detectada,frase_original,frase_normalizada,n_palabras
filipinas_000901,filipinas,901,religion,moral,"El perfume moral de la mujer bonita es el talento y el buen tono, es decir el hábito de las maneras clegantes y distinidas.",el perfume moral de la mujer bonita es el talento y el buen tono es decir el habito de las maneras clegantes y distinidas,24
filipinas_000902,filipinas,902,mujer,mujeres,"Las mujeres están dotadas generalmente de una gran facilidad de asimilación gracias á esa facultad, aún las más ignorantes adquieren rapidamente conocimientos, al menos superficiales para no hacer un mal papel entre las personas inteligentes.",las mujeres estan dotadas generalmente de una gran facilidad de asimilacion gracias a esa facultad aun las mas ignorantes adquieren rapidamente conocimientos al menos superficiales para no hacer un mal papel entre las personas inteligentes,35
filipinas_000939,filipinas,939,religion,virtud,"La amistad es un intercambio de cunlidades espirituales, es una virtud colateral.",la amistad es un intercambio de cunlidades espirituales es una virtud colateral,12
filipinas_000960,filipinas,960,mujer,mujer,"Bajo el influjo de su presencia, podemos decir y bacer cosas que no diriamos ni baríamos en otras circunstancins, nos estimulan mi pensamiento, vigorizan mis facultades, iluminan ini intellecto, despertan el sentimiento de la poesía alentro de mi y abren el caudal de mi clocuencia, mientras otros ahogan mis entusismos, rierran la válvula á mis espansiones y me encierran NAS MI TRISTEZA Yo nunca impongo mi tristeza, cualquiera triste puede ser. y esto lo da naturaleza ó la pasión de una mujer.",bajo el influjo de su presencia podemos decir y bacer cosas que no diriamos ni bariamos en otras circunstancins nos estimulan mi pensamiento vigorizan mis facultades iluminan ini intellecto despertan el sentimiento de la poesia alentro de mi y abren el caudal de mi clocuencia mientras otros ahogan mis entusismos rierran la valvula a mis espansiones y me encierran nas mi tristeza yo nunca impongo mi tristeza cualquiera triste puede ser y esto lo da naturaleza o la pasion de una mujer,82
filipinas_000970,filipinas,970,mujer,madre,"Error, error, mi adorable Pepita! Yo gusto de los dirigibles Zeppelin, de los aeroplanos Wright. ó Antoinette, de las teorías de Mara, de los liquismiquis picológicos de Hoffding ó de Oswald Kulpe. del valor de la energía molecular según los des cubrimientos últimos de Jean Perrin, de la Wald hute ó escuela al nire libre y hasta del presupuesto de Lloyd-George y del que pronto van á someter á nuestra Asamblea en Basvo, y, sin embargo de todo esto, yo gusto también de creer en un Sér Supremo, de leer el Kempis, hacer obras de caridad y dar, cuando no tiene ni madre, ni padre ni perro que le ladre, un poco de arroz ó un beso del corazón á un pobre haraposo y sucioImaginome, mi amadísima niña, que todo esto y mucho más que me callo, me otorgan pleno dere. cho á darte algunos consejos sobre casos y cosas Pudor mal comprendido Mi querida Pepita: Si mo vieses no me conocerlas.",error error mi adorable pepita yo gusto de los dirigibles zeppelin de los aeroplanos wright o antoinette de las teorias de mara de los liquismiquis picologicos de hoffding o de oswald kulpe del valor de la energia molecular segun los des cubrimientos ultimos de jean perrin de la wald hute o escuela al nire libre y hasta del presupuesto de lloyd george y del que pronto van a someter a nuestra asamblea en basvo y sin embargo de todo esto yo gusto tambien de creer en un ser supremo de leer el kempis hacer obras de caridad y dar cuando no tiene ni madre ni padre ni perro que le ladre un poco de arroz o un beso del corazon a un pobre haraposo y sucioimaginome mi amadisima nina que todo esto y mucho mas que me callo me otorgan pleno dere cho a darte algunos consejos sobre casos y cosas pudor mal comprendido mi querida pepita si mo vieses no me conocerlas,163
filipinas_000970,filipinas,970,educacion,escuela,"Error, error, mi adorable Pepita! Yo gusto de los dirigibles Zeppelin, de los aeroplanos Wright. ó Antoinette, de las teorías de Mara, de los liquismiquis picológicos de Hoffding ó de Oswald Kulpe. del valor de la energía molecular según los des cubrimientos últimos de Jean Perrin, de la Wald hute ó escuela al nire libre y hasta del presupuesto de Lloyd-George y del que pronto van á someter á nuestra Asamblea en Basvo, y, sin embargo de todo esto, yo gusto también de creer en un Sér Supremo, de leer el Kempis, hacer obras de caridad y dar, cuando no tiene ni madre, ni padre ni perro que le ladre, un poco de arroz ó un beso del corazón á un pobre haraposo y sucioImaginome, mi amadísima niña, que todo esto y mucho más que me callo, me otorgan pleno dere. cho á darte algunos consejos sobre casos y cosas Pudor mal comprendido Mi querida Pepita: Si mo vieses no me conocerlas.",error error mi adorable pepita yo gusto de los dirigibles zeppelin de los aeroplanos wright o antoinette de las teorias de mara de los liquismiquis picologicos de hoffding o de oswald kulpe del valor de la energia molecular segun los des cubrimientos ultimos de jean perrin de la wald hute o escuela al nire libre y hasta del presupuesto de lloyd george y del que pronto van a someter a nuestra asamblea en basvo y sin embargo de todo esto yo gusto tambien de creer en un ser supremo de leer el kempis hacer obras de caridad y dar cuando no tiene ni madre ni padre ni perro que le ladre un poco de arroz o un beso del corazon a un pobre haraposo y sucioimaginome mi amadisima nina que todo esto y mucho mas que me callo me otorgan pleno dere cho a darte algunos consejos sobre casos y cosas pudor mal comprendido mi querida pepita si mo vieses no me conocerlas,163
filipinas_000982,filipinas,982,mujer,mujeres,"Tastigueme Dios si miento al decirte lo que te digo con el alma en los labios! Pero tú has de saber, mi inolvidable Pepita, me si el pudor verdadero es una prenda excelente, por su valor moral y porque nos da á las mujeres vo no sé uné suave pariencia de rosas primaverales, el fingido, en cambio, aquel pudor, mal entendido, remilgoso y moniil, que os, según mis propias, observnciones, el más corriente en plaza, causagumimpresión tan desas trosa y chocunte al ánimo, que este, aún siendo el más tolerante en materia de critica femenina, prescinde de toda otra consideración y se vaderecho á pensar y ereer que ciertos aspectos ó manifestaciones del pudor son sencillamente á una hipocresia refinada ó una concepción hiperblica, cuando no falsa, de la pudibundez de nuestro sexo.",tastigueme dios si miento al decirte lo que te digo con el alma en los labios pero tu has de saber mi inolvidable pepita me si el pudor verdadero es una prenda excelente por su valor moral y porque nos da a las mujeres vo no se une suave pariencia de rosas primaverales el fingido en cambio aquel pudor mal entendido remilgoso y moniil que os segun mis propias observnciones el mas corriente en plaza causagumimpresion tan desas trosa y chocunte al animo que este aun siendo el mas tolerante en materia de critica femenina prescinde de toda otra consideracion y se vaderecho a pensar y ereer que ciertos aspectos o manifestaciones del pudor son sencillamente a una hipocresia refinada o una concepcion hiperblica cuando no falsa de la pudibundez de nuestro sexo,133
filipinas_000982,filipinas,982,mujer,femenina,"Tastigueme Dios si miento al decirte lo que te digo con el alma en los labios! Pero tú has de saber, mi inolvidable Pepita, me si el pudor verdadero es una prenda excelente, por su valor moral y porque nos da á las mujeres vo no sé uné suave pariencia de rosas primaverales, el fingido, en cambio, aquel pudor, mal entendido, remilgoso y moniil, que os, según mis propias, observnciones, el más corriente en plaza, causagumimpresión tan desas trosa y chocunte al ánimo, que este, aún siendo el más tolerante en materia de critica femenina, prescinde de toda otra consideración y se vaderecho á pensar y ereer que ciertos aspectos ó manifestaciones del pudor son sencillamente á una hipocresia refinada ó una concepción hiperblica, cuando no falsa, de la pudibundez de nuestro sexo.",tastigueme dios si miento al decirte lo que te digo con el alma en los labios pero tu has de saber mi inolvidable pepita me si el pudor verdadero es una prenda excelente por su valor moral y porque nos da a las mujeres vo no se une suave pariencia de rosas primaverales el fingido en cambio aquel pudor mal entendido remilgoso y moniil que os segun mis propias observnciones el mas corriente en plaza causagumimpresion tan desas trosa y chocunte al animo que este aun siendo el mas tolerante en materia de critica femenina prescinde de toda otra consideracion y se vaderecho a pensar y ereer que ciertos aspectos o manifestaciones del pudor son sencillamente a una hipocresia refinada o una concepcion hiperblica cuando no falsa de la pudibundez de nuestro sexo,133
filipinas_000982,filipinas,982,religion,dios,"Tastigueme Dios si miento al decirte lo que te digo con el alma en los labios! Pero tú has de saber, mi inolvidable Pepita, me si el pudor verdadero es una prenda excelente, por su valor moral y porque nos da á las mujeres vo no sé uné suave pariencia de rosas primaverales, el fingido, en cambio, aquel pudor, mal entendido, remilgoso y moniil, que os, según mis propias, observnciones, el más corriente en plaza, causagumimpresión tan desas trosa y chocunte al ánimo, que este, aún siendo el más tolerante en materia de critica femenina, prescinde de toda otra consideración y se vaderecho á pensar y ereer que ciertos aspectos ó manifestaciones del pudor son sencillamente á una hipocresia refinada ó una concepción hiperblica, cuando no falsa, de la pudibundez de nuestro sexo.",tastigueme dios si miento al decirte lo que te digo con el alma en los labios pero tu has de saber mi inolvidable pepita me si el pudor verdadero es una prenda excelente por su valor moral y porque nos da a las mujeres vo no se une suave pariencia de rosas primaverales el fingido en cambio aquel pudor mal entendido remilgoso y moniil que os segun mis propias observnciones el mas corriente en plaza causagumimpresion tan desas trosa y chocunte al animo que este aun siendo el mas tolerante en materia de critica femenina prescinde de toda otra consideracion y se vaderecho a pensar y ereer que ciertos aspectos o manifestaciones del pudor son sencillamente a una hipocresia refinada o una concepcion hiperblica cuando no falsa de la pudibundez de nuestro sexo,133
filipinas_000982,filipinas,982,religion,moral,"Tastigueme Dios si miento al decirte lo que te digo con el alma en los labios! Pero tú has de saber, mi inolvidable Pepita, me si el pudor verdadero es una prenda excelente, por su valor moral y porque nos da á las mujeres vo no sé uné suave pariencia de rosas primaverales, el fingido, en cambio, aquel pudor, mal entendido, remilgoso y moniil, que os, según mis propias, observnciones, el más corriente en plaza, causagumimpresión tan desas trosa y chocunte al ánimo, que este, aún siendo el más tolerante en materia de critica femenina, prescinde de toda otra consideración y se vaderecho á pensar y ereer que ciertos aspectos ó manifestaciones del pudor son sencillamente á una hipocresia refinada ó una concepción hiperblica, cuando no falsa, de la pudibundez de nuestro sexo.",tastigueme dios si miento al decirte lo que te digo con el alma en los labios pero tu has de saber mi inolvidable pepita me si el pudor verdadero es una prenda excelente por su valor moral y porque nos da a las mujeres vo no se une suave pariencia de rosas primaverales el fingido en cambio aquel pudor mal entendido remilgoso y moniil que os segun mis propias observnciones el mas corriente en plaza causagumimpresion tan desas trosa y chocunte al animo que este aun siendo el mas tolerante en materia de critica femenina prescinde de toda otra consideracion y se vaderecho a pensar y ereer que ciertos aspectos o manifestaciones del pudor son sencillamente a una hipocresia refinada o una concepcion hiperblica cuando no falsa de la pudibundez de nuestro sexo,133
filipinas_000983,filipinas,983,hogar,casa,"Supongo que habrás asistido á fiestas, iiras y otras reuniones honestas de la buen sociedad blipina; supongo que no te faltan amigos, porque no hay manera de evitarlos, sobre todo cuando se lienen los ojos negros y los labios húmedos rojos y la tez suavemente morena como tu y supongo, en fin, que te han invitado alguna de otra vez á una comida de confianza en casa de cualquiera de tus amistades.",supongo que habras asistido a fiestas iiras y otras reuniones honestas de la buen sociedad blipina supongo que no te faltan amigos porque no hay manera de evitarlos sobre todo cuando se lienen los ojos negros y los labios humedos rojos y la tez suavemente morena como tu y supongo en fin que te han invitado alguna de otra vez a una comida de confianza en casa de cualquiera de tus amistades,72
filipinas_000984,filipinas,984,educacion,cultura,"Pues bien, mi querida Pepita; si tú has formado rancho aparte en esas reuniones, como estuvieses nquejada de misantropía ó temeses que los hombres padecieran de alguna dolencia contagiosa; si tú, al saludarte ellos con un apretón de manos, les has alargado solo dos dedos o á lo sumo tres de la tuva, y si luego, te bas ido corriendo á encerrarte en el cuarto y los de eshas nconselado á tus amigas, que la comida fuese de muieres solas como ciertos ejercicios espirituales; si todo eso has hecho, has dicho ó bas pensado, perdóname que te diga entonces que no anduviste correcta, que tu noción del pudor era falsa, completamente falsa, y que, sin duda, contra tu voluntad misma, has hecho creer al sexo fuerte,—y contigo las otras—que pis unas señoritas cortas de genio é incomprensiblemente desdeñosas para con los hombres y refractarias á la vida y cultura social.",pues bien mi querida pepita si tu has formado rancho aparte en esas reuniones como estuvieses nquejada de misantropia o temeses que los hombres padecieran de alguna dolencia contagiosa si tu al saludarte ellos con un apreton de manos les has alargado solo dos dedos o a lo sumo tres de la tuva y si luego te bas ido corriendo a encerrarte en el cuarto y los de eshas nconselado a tus amigas que la comida fuese de muieres solas como ciertos ejercicios espirituales si todo eso has hecho has dicho o bas pensado perdoname que te diga entonces que no anduviste correcta que tu nocion del pudor era falsa completamente falsa y que sin duda contra tu voluntad misma has hecho creer al sexo fuerte y contigo las otras que pis unas senoritas cortas de genio e incomprensiblemente desdenosas para con los hombres y refractarias a la vida y cultura social,152
filipinas_000987,filipinas,987,hogar,casa,"Si te ofrecen su mano en signo de amistosa cordialidadad los caballeros, dá la tuva también sin regateos ni muestras de repulsión y despego—Hay cad manita floia y como desganada que produce la impresión de un copo de algodón en rama.! Tampoco te recluvas en el cuarto de dormir de la dueña de la casa ó en el tocador de alguna de sus hijas.",si te ofrecen su mano en signo de amistosa cordialidadad los caballeros da la tuva tambien sin regateos ni muestras de repulsion y despego hay cad manita floia y como desganada que produce la impresion de un copo de algodon en rama tampoco te recluvas en el cuarto de dormir de la duena de la casa o en el tocador de alguna de sus hijas,65
filipinas_000987,filipinas,987,hogar,hijas,"Si te ofrecen su mano en signo de amistosa cordialidadad los caballeros, dá la tuva también sin regateos ni muestras de repulsión y despego—Hay cad manita floia y como desganada que produce la impresión de un copo de algodón en rama.! Tampoco te recluvas en el cuarto de dormir de la dueña de la casa ó en el tocador de alguna de sus hijas.",si te ofrecen su mano en signo de amistosa cordialidadad los caballeros da la tuva tambien sin regateos ni muestras de repulsion y despego hay cad manita floia y como desganada que produce la impresion de un copo de algodon en rama tampoco te recluvas en el cuarto de dormir de la duena de la casa o en el tocador de alguna de sus hijas,65
filipinas_000991,filipinas,991,mujer,madre,"Y luego es tan triste eso de comer solas. solas en la mesa, como si todas, estuviéramos vindas ó huérfanas de padre y madre, y no tuviéramos un sólo hermano á la vera!...",y luego es tan triste eso de comer solas solas en la mesa como si todas estuvieramos vindas o huerfanas de padre y madre y no tuvieramos un solo hermano a la vera,33
filipinas_000992,filipinas,992,religion,dios,"Y ahoro quédate con Dios, mi querida Pepita.",y ahoro quedate con dios mi querida pepita,8
filipinas_000994,filipinas,994,raza,blanco,"No te olvides de esta pobrecita vieja, de tu antigua maestra de labores, que, por no perder la costumbre, se dedica en su ancianidad á regar tiestos de malvarrosa y jazmin, á cuidar un perrito muy mono y muy blanco que se llamaChichia y á tirarles migas de pan y palay á una decena y media de gallos y gallinas.",no te olvides de esta pobrecita vieja de tu antigua maestra de labores que por no perder la costumbre se dedica en su ancianidad a regar tiestos de malvarrosa y jazmin a cuidar un perrito muy mono y muy blanco que se llamachichia y a tirarles migas de pan y palay a una decena y media de gallos y gallinas,60
filipinas_000995,filipinas,995,mujer,madre,Y como las viejas apenas si aciertan á besar. me abstengo de enviarte el beso de rúbrica para bendecirie en cambio como una madre.,y como las viejas apenas si aciertan a besar me abstengo de enviarte el beso de rubrica para bendecirie en cambio como una madre,24
filipinas_000997,filipinas,997,mujer,mujer,"FILIPINAS LA MUJER EN LA PAMILIA Animada por el deseo de ser útil á las lecforas de este simpático semanario y de cooperan en la ardun tarea emprendida por su fundador, me he decidido á escribir una serie de artículo sobre la misión que la mujer está llamada á dess empeñar en el seno de la familia, es decir en el dulce hogar, y los deberes que su condición le impone.",filipinas la mujer en la pamilia animada por el deseo de ser util a las lecforas de este simpatico semanario y de cooperan en la ardun tarea emprendida por su fundador me he decidido a escribir una serie de articulo sobre la mision que la mujer esta llamada a dess empenar en el seno de la familia es decir en el dulce hogar y los deberes que su condicion le impone,71
filipinas_000997,filipinas,997,hogar,hogar,"FILIPINAS LA MUJER EN LA PAMILIA Animada por el deseo de ser útil á las lecforas de este simpático semanario y de cooperan en la ardun tarea emprendida por su fundador, me he decidido á escribir una serie de artículo sobre la misión que la mujer está llamada á dess empeñar en el seno de la familia, es decir en el dulce hogar, y los deberes que su condición le impone.",filipinas la mujer en la pamilia animada por el deseo de ser util a las lecforas de este simpatico semanario y de cooperan en la ardun tarea emprendida por su fundador me he decidido a escribir una serie de articulo sobre la mision que la mujer esta llamada a dess empenar en el seno de la familia es decir en el dulce hogar y los deberes que su condicion le impone,71
filipinas_000997,filipinas,997,hogar,familia,"FILIPINAS LA MUJER EN LA PAMILIA Animada por el deseo de ser útil á las lecforas de este simpático semanario y de cooperan en la ardun tarea emprendida por su fundador, me he decidido á escribir una serie de artículo sobre la misión que la mujer está llamada á dess empeñar en el seno de la familia, es decir en el dulce hogar, y los deberes que su condición le impone.",filipinas la mujer en la pamilia animada por el deseo de ser util a las lecforas de este simpatico semanario y de cooperan en la ardun tarea emprendida por su fundador me he decidido a escribir una serie de articulo sobre la mision que la mujer esta llamada a dess empenar en el seno de la familia es decir en el dulce hogar y los deberes que su condicion le impone,71
filipinas_000998,filipinas,998,educacion,inteligencia,"Me propongo describir la vida tal como es, ó al menos tal como á mi inteligencia se presenta, sin trazar cuadros fantásticos á las jóvenes cuyn existencia, comenza.",me propongo describir la vida tal como es o al menos tal como a mi inteligencia se presenta sin trazar cuadros fantasticos a las jovenes cuyn existencia comenza,28
filipinas_001000,filipinas,1000,educacion,instrucción,"La inocencia de la vida y la fé de la ignorancia cuando por la realidad, la instrucción y el entendimiento no se hallan en aptitud de ver la verdad en orden á todas las cosas, suelen ser las más funestas conseieras.",la inocencia de la vida y la fe de la ignorancia cuando por la realidad la instruccion y el entendimiento no se hallan en aptitud de ver la verdad en orden a todas las cosas suelen ser las mas funestas conseieras,41
filipinas_001001,filipinas,1001,mujer,mujeres,"Frecuentemente sucede, que muchas mujeres encuentran insoportable la vida estando sujetas al vugo de la familia; y es, las más de las veces. por falta de conocimientos y preparaciones une debe tener para soportar con fortaleza mayor las lversidades inevitables de la existencia.",frecuentemente sucede que muchas mujeres encuentran insoportable la vida estando sujetas al vugo de la familia y es las mas de las veces por falta de conocimientos y preparaciones une debe tener para soportar con fortaleza mayor las lversidades inevitables de la existencia,43
filipinas_001001,filipinas,1001,hogar,familia,"Frecuentemente sucede, que muchas mujeres encuentran insoportable la vida estando sujetas al vugo de la familia; y es, las más de las veces. por falta de conocimientos y preparaciones une debe tener para soportar con fortaleza mayor las lversidades inevitables de la existencia.",frecuentemente sucede que muchas mujeres encuentran insoportable la vida estando sujetas al vugo de la familia y es las mas de las veces por falta de conocimientos y preparaciones une debe tener para soportar con fortaleza mayor las lversidades inevitables de la existencia,43
filipinas_001015,filipinas,1015,mujer,madre,"MADRE, ¿quereis criar á vuestros hijos sanos y robustos para que en el dia de mañana sean dignos apoyos de la Pátria querida? Alimentadlos con los fabricados bizcochos de La FORTUNA.",madre quereis criar a vuestros hijos sanos y robustos para que en el dia de manana sean dignos apoyos de la patria querida alimentadlos con los fabricados bizcochos de la fortuna,31
filipinas_001015,filipinas,1015,patria,patria,"MADRE, ¿quereis criar á vuestros hijos sanos y robustos para que en el dia de mañana sean dignos apoyos de la Pátria querida? Alimentadlos con los fabricados bizcochos de La FORTUNA.",madre quereis criar a vuestros hijos sanos y robustos para que en el dia de manana sean dignos apoyos de la patria querida alimentadlos con los fabricados bizcochos de la fortuna,31
filipinas_001015,filipinas,1015,hogar,hijos,"MADRE, ¿quereis criar á vuestros hijos sanos y robustos para que en el dia de mañana sean dignos apoyos de la Pátria querida? Alimentadlos con los fabricados bizcochos de La FORTUNA.",madre quereis criar a vuestros hijos sanos y robustos para que en el dia de manana sean dignos apoyos de la patria querida alimentadlos con los fabricados bizcochos de la fortuna,31
filipinas_001019,filipinas,1019,mujer,mujer,"En aquel momento una mujer ioven, morena, de oios soñolientos y negros que tenían indefinible dulzura á la vez que de tristeza, de ovalado rostro y de cuerpo diminuto se hallaba sentada en uno de los bancos que están llan colocados en aquel agradable sitio.",en aquel momento una mujer ioven morena de oios sonolientos y negros que tenian indefinible dulzura a la vez que de tristeza de ovalado rostro y de cuerpo diminuto se hallaba sentada en uno de los bancos que estan llan colocados en aquel agradable sitio,45
filipinas_001027,filipinas,1027,mujer,madre,"A veces envidio la cabaña de donde sale bendecida por sus hijos la madre de familia n es perar la barca del pescador, su inquietud por vislumbrarla en el horizonte, sus gritos de alegria cuando la ve, sus transportes cuando salta si osperado compañero á tierra, su gozo en iirar los pescados de mil colores, vivos aún en la arena, el afán con que recogo los mas grandes y mejores que tre el padre para sus hijelos, la santa legría que reina en la cabaña, alerezada para recibir á su dueño, y.., yo no puedo gozar de esos placeres Mira.",a veces envidio la cabana de donde sale bendecida por sus hijos la madre de familia n es perar la barca del pescador su inquietud por vislumbrarla en el horizonte sus gritos de alegria cuando la ve sus transportes cuando salta si osperado companero a tierra su gozo en iirar los pescados de mil colores vivos aun en la arena el afan con que recogo los mas grandes y mejores que tre el padre para sus hijelos la santa legria que reina en la cabana alerezada para recibir a su dueno y yo no puedo gozar de esos placeres mira,100
